review_id,user_id,movie_id,rating,comment,created_at
582,616,781,5,Suspendisse accumsan tortor quis turpis. Sed ante.,3/1/25
583,486,113,4,Fusce consequat.,7/20/24
584,180,824,5,"Duis mattis egestas metus. Aenean fermentum. Donec ut mauris eget massa tempor convallis. Nulla neque libero, convallis eget, eleifend luctus, ultricies eu, nibh.",5/29/24
585,253,159,2,"Proin leo odio, porttitor id, consequat in, consequat ut, nulla. Sed accumsan felis. Ut at dolor quis odio consequat varius. Integer ac leo.",6/18/25
586,410,174,1,Nulla mollis molestie lorem. Quisque ut erat.,3/29/25
587,312,786,1,Praesent blandit lacinia erat. Vestibulum sed magna at nunc commodo placerat.,9/30/24
588,3,37,2,Praesent blandit lacinia erat. Vestibulum sed magna at nunc commodo placerat. Praesent blandit. Nam nulla.,9/13/24
589,667,100,1,"Duis ac nibh. Fusce lacus purus, aliquet at, feugiat non, pretium quis, lectus. Suspendisse potenti.",7/2/25
590,80,9,5,Sed ante. Vivamus tortor. Duis mattis egestas metus.,6/23/25
591,605,968,1,"Duis bibendum, felis sed interdum venenatis, turpis enim blandit mi, in porttitor pede justo eu massa. Donec dapibus.",11/12/24
592,581,206,1,Etiam justo. Etiam pretium iaculis justo.,9/7/24
593,632,97,2,Maecenas rhoncus aliquam lacus. Morbi quis tortor id nulla ultrices aliquet.,8/2/25
594,379,75,1,Sed ante.,3/2/25
595,777,44,5,Aenean lectus. Pellentesque eget nunc. Donec quis orci eget orci vehicula condimentum. Curabitur in libero ut massa volutpat convallis.,12/11/24
596,761,987,3,"Proin leo odio, porttitor id, consequat in, consequat ut, nulla. Sed accumsan felis.",7/17/25
597,66,410,1,"Morbi ut odio. Cras mi pede, malesuada in, imperdiet et, commodo vulputate, justo. In blandit ultrices enim. Lorem ipsum dolor sit amet, consectetuer adipiscing elit.",8/31/24
598,206,938,5,"In hac habitasse platea dictumst. Aliquam augue quam, sollicitudin vitae, consectetuer eget, rutrum at, lorem.",8/11/24
599,402,67,5,Vestibulum ante ipsum primis in faucibus orci luctus et ultrices posuere cubilia Curae; Mauris viverra diam vitae quam. Suspendisse potenti.,10/30/24
600,605,414,5,"Duis ac nibh. Fusce lacus purus, aliquet at, feugiat non, pretium quis, lectus. Suspendisse potenti. In eleifend quam a odio.",6/30/25
601,436,137,2,Pellentesque at nulla. Suspendisse potenti. Cras in purus eu magna vulputate luctus.,6/5/25
602,407,482,3,Nulla facilisi. Cras non velit nec nisi vulputate nonummy. Maecenas tincidunt lacus at velit. Vivamus vel nulla eget eros elementum pellentesque.,10/4/24
603,234,750,1,"Mauris enim leo, rhoncus sed, vestibulum sit amet, cursus id, turpis. Integer aliquet, massa id lobortis convallis, tortor risus dapibus augue, vel accumsan tellus nisi eu orci. Mauris lacinia sapien quis libero.",5/3/25
604,762,496,3,Donec quis orci eget orci vehicula condimentum.,1/23/25
605,889,499,3,Morbi non quam nec dui luctus rutrum. Nulla tellus.,8/12/25
606,433,190,3,Proin at turpis a pede posuere nonummy.,8/8/24
607,905,411,4,"Mauris enim leo, rhoncus sed, vestibulum sit amet, cursus id, turpis. Integer aliquet, massa id lobortis convallis, tortor risus dapibus augue, vel accumsan tellus nisi eu orci. Mauris lacinia sapien quis libero. Nullam sit amet turpis elementum ligula vehicula consequat.",3/5/25
608,402,35,4,Etiam faucibus cursus urna. Ut tellus. Nulla ut erat id mauris vulputate elementum. Nullam varius.,5/12/25
609,246,191,2,Nulla facilisi.,8/15/24
610,566,198,4,Pellentesque ultrices mattis odio.,11/18/24
611,316,259,2,Phasellus in felis. Donec semper sapien a libero.,8/12/24
612,470,279,4,Suspendisse accumsan tortor quis turpis.,4/18/25
613,231,824,5,Sed vel enim sit amet nunc viverra dapibus. Nulla suscipit ligula in lacus.,7/15/24
614,549,824,2,Sed ante. Vivamus tortor. Duis mattis egestas metus. Aenean fermentum.,8/24/24
615,852,832,3,Nullam molestie nibh in lectus. Pellentesque at nulla.,4/8/25
616,23,821,4,"Cum sociis natoque penatibus et magnis dis parturient montes, nascetur ridiculus mus. Vivamus vestibulum sagittis sapien.",7/9/24
617,611,589,2,Pellentesque viverra pede ac diam.,2/1/25
618,232,586,1,"Donec ut dolor. Morbi vel lectus in quam fringilla rhoncus. Mauris enim leo, rhoncus sed, vestibulum sit amet, cursus id, turpis. Integer aliquet, massa id lobortis convallis, tortor risus dapibus augue, vel accumsan tellus nisi eu orci.",5/16/25
619,122,687,3,Curabitur convallis.,1/16/25
620,883,844,4,"Duis at velit eu est congue elementum. In hac habitasse platea dictumst. Morbi vestibulum, velit id pretium iaculis, diam erat fermentum justo, nec condimentum neque sapien placerat ante.",8/30/24
621,921,226,4,"Nam ultrices, libero non mattis pulvinar, nulla pede ullamcorper augue, a suscipit nulla elit ac nulla.",7/18/24
622,427,559,4,"Nulla nisl. Nunc nisl. Duis bibendum, felis sed interdum venenatis, turpis enim blandit mi, in porttitor pede justo eu massa.",11/3/24
623,830,711,1,Etiam faucibus cursus urna. Ut tellus.,1/28/25
624,98,33,4,"Pellentesque viverra pede ac diam. Cras pellentesque volutpat dui. Maecenas tristique, est et tempus semper, est quam pharetra magna, ac consequat metus sapien ut nunc.",7/22/25
625,486,37,5,"Morbi non lectus. Aliquam sit amet diam in magna bibendum imperdiet. Nullam orci pede, venenatis non, sodales sed, tincidunt eu, felis. Fusce posuere felis sed lacus.",11/12/24
626,701,433,1,Nullam porttitor lacus at turpis. Donec posuere metus vitae ipsum.,2/18/25
627,570,315,4,Aliquam quis turpis eget elit sodales scelerisque. Mauris sit amet eros. Suspendisse accumsan tortor quis turpis. Sed ante.,7/28/25
628,97,418,2,Integer tincidunt ante vel ipsum. Praesent blandit lacinia erat.,6/11/24
629,515,318,4,"Nulla tellus. In sagittis dui vel nisl. Duis ac nibh. Fusce lacus purus, aliquet at, feugiat non, pretium quis, lectus.",2/21/25
630,407,361,5,"Nunc rhoncus dui vel sem. Sed sagittis. Nam congue, risus semper porta volutpat, quam pede lobortis ligula, sit amet eleifend pede libero quis orci. Nullam molestie nibh in lectus.",9/12/24
631,899,873,3,Nullam varius. Nulla facilisi.,3/28/25
632,656,362,2,"Donec odio justo, sollicitudin ut, suscipit a, feugiat et, eros.",6/28/24
633,609,341,1,"Suspendisse ornare consequat lectus. In est risus, auctor sed, tristique in, tempus sit amet, sem. Fusce consequat.",4/6/25
634,694,461,4,"Donec dapibus. Duis at velit eu est congue elementum. In hac habitasse platea dictumst. Morbi vestibulum, velit id pretium iaculis, diam erat fermentum justo, nec condimentum neque sapien placerat ante.",5/27/24
635,918,531,1,Proin risus.,8/14/25
636,109,448,2,Vestibulum sed magna at nunc commodo placerat. Praesent blandit.,3/18/25
637,283,441,1,"Aenean sit amet justo. Morbi ut odio. Cras mi pede, malesuada in, imperdiet et, commodo vulputate, justo.",5/28/25
638,111,531,3,Ut tellus. Nulla ut erat id mauris vulputate elementum. Nullam varius.,5/27/24
639,345,254,5,Maecenas tincidunt lacus at velit. Vivamus vel nulla eget eros elementum pellentesque. Quisque porta volutpat erat.,5/26/25
640,124,883,2,Pellentesque viverra pede ac diam. Cras pellentesque volutpat dui.,11/8/24
641,68,243,2,Nullam porttitor lacus at turpis.,5/17/25
642,222,88,3,Ut at dolor quis odio consequat varius.,6/22/24
643,712,160,5,Maecenas ut massa quis augue luctus tincidunt.,6/26/25
644,322,762,4,"Vestibulum ante ipsum primis in faucibus orci luctus et ultrices posuere cubilia Curae; Nulla dapibus dolor vel est. Donec odio justo, sollicitudin ut, suscipit a, feugiat et, eros. Vestibulum ac est lacinia nisi venenatis tristique. Fusce congue, diam id ornare imperdiet, sapien urna pretium nisl, ut volutpat sapien arcu sed augue.",4/15/25
645,319,265,2,Aliquam sit amet diam in magna bibendum imperdiet.,6/23/24
646,304,75,4,"Vestibulum quam sapien, varius ut, blandit non, interdum in, ante. Vestibulum ante ipsum primis in faucibus orci luctus et ultrices posuere cubilia Curae; Duis faucibus accumsan odio. Curabitur convallis. Duis consequat dui nec nisi volutpat eleifend.",3/25/25
647,683,807,1,Ut at dolor quis odio consequat varius. Integer ac leo. Pellentesque ultrices mattis odio.,6/2/24
648,382,105,2,Nulla tempus. Vivamus in felis eu sapien cursus vestibulum. Proin eu mi. Nulla ac enim.,8/13/24
649,403,465,1,"Aliquam sit amet diam in magna bibendum imperdiet. Nullam orci pede, venenatis non, sodales sed, tincidunt eu, felis. Fusce posuere felis sed lacus.",10/30/24
650,284,430,2,"Morbi porttitor lorem id ligula. Suspendisse ornare consequat lectus. In est risus, auctor sed, tristique in, tempus sit amet, sem.",4/10/25
651,338,364,1,Phasellus sit amet erat. Nulla tempus.,7/15/24
652,32,200,3,Integer tincidunt ante vel ipsum. Praesent blandit lacinia erat. Vestibulum sed magna at nunc commodo placerat.,1/15/25
653,293,350,2,In sagittis dui vel nisl. Duis ac nibh.,7/22/24
654,790,858,1,Nulla ut erat id mauris vulputate elementum. Nullam varius. Nulla facilisi. Cras non velit nec nisi vulputate nonummy.,6/16/25
655,87,50,4,Etiam vel augue.,3/17/25
656,997,825,4,"Sed sagittis. Nam congue, risus semper porta volutpat, quam pede lobortis ligula, sit amet eleifend pede libero quis orci.",1/31/25
657,569,428,2,Morbi a ipsum. Integer a nibh.,4/22/25
658,542,552,1,Vestibulum rutrum rutrum neque. Aenean auctor gravida sem. Praesent id massa id nisl venenatis lacinia. Aenean sit amet justo.,10/5/24
659,680,920,4,"Nulla ac enim. In tempor, turpis nec euismod scelerisque, quam turpis adipiscing lorem, vitae mattis nibh ligula nec sem. Duis aliquam convallis nunc.",8/29/24
660,786,552,2,"Cum sociis natoque penatibus et magnis dis parturient montes, nascetur ridiculus mus.",3/15/25
661,191,831,4,Donec posuere metus vitae ipsum. Aliquam non mauris.,7/15/24
662,878,529,4,"In quis justo. Maecenas rhoncus aliquam lacus. Morbi quis tortor id nulla ultrices aliquet. Maecenas leo odio, condimentum id, luctus nec, molestie sed, justo.",2/24/25
663,838,685,1,Nullam sit amet turpis elementum ligula vehicula consequat. Morbi a ipsum. Integer a nibh.,7/17/25
664,416,959,2,Ut tellus. Nulla ut erat id mauris vulputate elementum.,5/9/25
665,413,562,5,Phasellus sit amet erat. Nulla tempus. Vivamus in felis eu sapien cursus vestibulum. Proin eu mi.,12/14/24
666,281,993,4,Phasellus sit amet erat. Nulla tempus.,1/14/25
667,90,103,4,"Proin at turpis a pede posuere nonummy. Integer non velit. Donec diam neque, vestibulum eget, vulputate ut, ultrices vel, augue.",1/3/25
668,423,282,3,Nulla ut erat id mauris vulputate elementum. Nullam varius. Nulla facilisi.,2/18/25
669,55,314,4,Curabitur gravida nisi at nibh.,12/7/24
670,560,521,5,Nullam varius.,9/27/24
671,470,585,3,Quisque porta volutpat erat.,3/17/25
672,22,181,5,Suspendisse accumsan tortor quis turpis. Sed ante. Vivamus tortor.,5/25/25
673,303,626,3,In hac habitasse platea dictumst. Etiam faucibus cursus urna. Ut tellus.,10/22/24
674,543,637,1,Duis aliquam convallis nunc. Proin at turpis a pede posuere nonummy. Integer non velit.,12/23/24
675,355,42,2,Pellentesque viverra pede ac diam. Cras pellentesque volutpat dui.,10/26/24
676,922,336,4,"Fusce consequat. Nulla nisl. Nunc nisl. Duis bibendum, felis sed interdum venenatis, turpis enim blandit mi, in porttitor pede justo eu massa.",6/21/24
677,111,986,1,Curabitur gravida nisi at nibh.,3/6/25
678,611,458,4,Donec quis orci eget orci vehicula condimentum. Curabitur in libero ut massa volutpat convallis.,10/23/24
679,441,508,4,"Donec ut dolor. Morbi vel lectus in quam fringilla rhoncus. Mauris enim leo, rhoncus sed, vestibulum sit amet, cursus id, turpis.",11/15/24
680,250,738,3,Nulla justo. Aliquam quis turpis eget elit sodales scelerisque. Mauris sit amet eros. Suspendisse accumsan tortor quis turpis.,4/8/25
681,213,157,5,Proin eu mi. Nulla ac enim.,7/6/24
682,102,231,5,Mauris lacinia sapien quis libero. Nullam sit amet turpis elementum ligula vehicula consequat. Morbi a ipsum. Integer a nibh.,5/11/25
683,448,309,5,Nulla facilisi.,12/1/24
684,769,582,4,Vestibulum sed magna at nunc commodo placerat. Praesent blandit.,3/31/25
685,82,64,2,"Maecenas leo odio, condimentum id, luctus nec, molestie sed, justo.",1/15/25
686,227,453,3,Mauris sit amet eros.,5/29/25
687,332,752,4,"Duis bibendum, felis sed interdum venenatis, turpis enim blandit mi, in porttitor pede justo eu massa. Donec dapibus. Duis at velit eu est congue elementum. In hac habitasse platea dictumst.",2/19/25
688,685,109,2,Donec vitae nisi.,6/23/24
689,128,858,2,Aliquam non mauris. Morbi non lectus.,7/12/24
690,589,859,2,"Maecenas tristique, est et tempus semper, est quam pharetra magna, ac consequat metus sapien ut nunc.",11/8/24
691,255,213,3,Donec posuere metus vitae ipsum. Aliquam non mauris. Morbi non lectus.,12/25/24
692,171,258,1,"Mauris ullamcorper purus sit amet nulla. Quisque arcu libero, rutrum ac, lobortis vel, dapibus at, diam. Nam tristique tortor eu pede.",12/1/24
693,985,534,5,"Donec semper sapien a libero. Nam dui. Proin leo odio, porttitor id, consequat in, consequat ut, nulla. Sed accumsan felis.",6/4/24
694,605,860,5,"Maecenas leo odio, condimentum id, luctus nec, molestie sed, justo. Pellentesque viverra pede ac diam. Cras pellentesque volutpat dui.",6/15/25
695,624,920,4,Pellentesque eget nunc. Donec quis orci eget orci vehicula condimentum.,8/13/24
696,157,459,2,Nulla suscipit ligula in lacus. Curabitur at ipsum ac tellus semper interdum.,1/27/25
697,679,855,1,Sed vel enim sit amet nunc viverra dapibus. Nulla suscipit ligula in lacus. Curabitur at ipsum ac tellus semper interdum. Mauris ullamcorper purus sit amet nulla.,6/28/25
698,631,423,1,"Fusce posuere felis sed lacus. Morbi sem mauris, laoreet ut, rhoncus aliquet, pulvinar sed, nisl.",12/1/24
699,488,79,4,Etiam pretium iaculis justo. In hac habitasse platea dictumst.,5/29/25
700,256,999,3,Vestibulum rutrum rutrum neque.,6/30/25
701,527,825,3,"Morbi odio odio, elementum eu, interdum eu, tincidunt in, leo. Maecenas pulvinar lobortis est. Phasellus sit amet erat.",3/7/25
702,244,833,3,"Donec ut mauris eget massa tempor convallis. Nulla neque libero, convallis eget, eleifend luctus, ultricies eu, nibh. Quisque id justo sit amet sapien dignissim vestibulum.",11/1/24
703,552,892,2,"Cum sociis natoque penatibus et magnis dis parturient montes, nascetur ridiculus mus. Etiam vel augue. Vestibulum rutrum rutrum neque. Aenean auctor gravida sem.",7/20/24
704,958,900,2,"Cum sociis natoque penatibus et magnis dis parturient montes, nascetur ridiculus mus. Etiam vel augue. Vestibulum rutrum rutrum neque.",5/13/25
705,291,453,4,Suspendisse potenti. Nullam porttitor lacus at turpis.,12/13/24
706,946,845,5,"Vestibulum ante ipsum primis in faucibus orci luctus et ultrices posuere cubilia Curae; Nulla dapibus dolor vel est. Donec odio justo, sollicitudin ut, suscipit a, feugiat et, eros. Vestibulum ac est lacinia nisi venenatis tristique.",2/28/25
707,29,841,1,Duis mattis egestas metus. Aenean fermentum. Donec ut mauris eget massa tempor convallis.,2/9/25
708,617,421,4,Proin eu mi. Nulla ac enim.,6/4/24
709,427,179,3,"Nullam orci pede, venenatis non, sodales sed, tincidunt eu, felis.",6/14/25
710,109,60,3,"Lorem ipsum dolor sit amet, consectetuer adipiscing elit. Proin interdum mauris non ligula pellentesque ultrices. Phasellus id sapien in sapien iaculis congue. Vivamus metus arcu, adipiscing molestie, hendrerit at, vulputate vitae, nisl.",11/17/24
711,126,625,2,Suspendisse accumsan tortor quis turpis. Sed ante.,11/25/24
712,722,911,4,Ut tellus.,1/16/25
713,283,851,1,Phasellus sit amet erat. Nulla tempus. Vivamus in felis eu sapien cursus vestibulum. Proin eu mi.,2/4/25
714,302,198,1,Mauris lacinia sapien quis libero. Nullam sit amet turpis elementum ligula vehicula consequat. Morbi a ipsum. Integer a nibh.,4/8/25
715,179,761,2,"Proin interdum mauris non ligula pellentesque ultrices. Phasellus id sapien in sapien iaculis congue. Vivamus metus arcu, adipiscing molestie, hendrerit at, vulputate vitae, nisl. Aenean lectus.",11/7/24
716,627,126,2,"Vestibulum quam sapien, varius ut, blandit non, interdum in, ante. Vestibulum ante ipsum primis in faucibus orci luctus et ultrices posuere cubilia Curae; Duis faucibus accumsan odio.",8/26/24
717,584,974,3,Etiam pretium iaculis justo. In hac habitasse platea dictumst.,1/26/25
718,365,835,1,"In tempor, turpis nec euismod scelerisque, quam turpis adipiscing lorem, vitae mattis nibh ligula nec sem. Duis aliquam convallis nunc. Proin at turpis a pede posuere nonummy. Integer non velit.",12/2/24
719,510,668,1,Etiam vel augue. Vestibulum rutrum rutrum neque. Aenean auctor gravida sem.,8/4/25
720,60,598,3,Suspendisse potenti. Cras in purus eu magna vulputate luctus.,7/23/25
721,525,312,3,"Vivamus vestibulum sagittis sapien. Cum sociis natoque penatibus et magnis dis parturient montes, nascetur ridiculus mus.",10/12/24
722,522,655,1,Quisque ut erat. Curabitur gravida nisi at nibh.,6/2/25
723,980,415,5,Vivamus in felis eu sapien cursus vestibulum. Proin eu mi.,7/29/24
724,164,731,5,In eleifend quam a odio. In hac habitasse platea dictumst. Maecenas ut massa quis augue luctus tincidunt.,10/28/24
725,558,528,2,Nunc rhoncus dui vel sem.,6/4/24
726,470,747,3,Vestibulum ante ipsum primis in faucibus orci luctus et ultrices posuere cubilia Curae; Mauris viverra diam vitae quam.,3/4/25
727,900,723,5,Pellentesque at nulla. Suspendisse potenti. Cras in purus eu magna vulputate luctus.,5/20/24
728,168,372,4,Ut tellus. Nulla ut erat id mauris vulputate elementum.,6/28/25
729,972,194,5,"Fusce posuere felis sed lacus. Morbi sem mauris, laoreet ut, rhoncus aliquet, pulvinar sed, nisl. Nunc rhoncus dui vel sem. Sed sagittis.",7/22/24
730,171,129,4,Maecenas tincidunt lacus at velit. Vivamus vel nulla eget eros elementum pellentesque.,8/15/24
731,921,145,5,Nulla tempus.,8/13/24
732,395,798,4,"Vivamus vel nulla eget eros elementum pellentesque. Quisque porta volutpat erat. Quisque erat eros, viverra eget, congue eget, semper rutrum, nulla.",9/30/24
733,578,443,3,Aenean fermentum.,6/9/25
734,726,184,4,Duis consequat dui nec nisi volutpat eleifend.,3/12/25
735,936,171,2,Fusce posuere felis sed lacus.,5/9/25
736,374,67,4,"Suspendisse potenti. Cras in purus eu magna vulputate luctus. Cum sociis natoque penatibus et magnis dis parturient montes, nascetur ridiculus mus.",12/3/24
737,250,170,2,"Proin interdum mauris non ligula pellentesque ultrices. Phasellus id sapien in sapien iaculis congue. Vivamus metus arcu, adipiscing molestie, hendrerit at, vulputate vitae, nisl. Aenean lectus.",5/23/25
738,948,13,3,In sagittis dui vel nisl.,6/21/25
739,119,720,3,"Quisque id justo sit amet sapien dignissim vestibulum. Vestibulum ante ipsum primis in faucibus orci luctus et ultrices posuere cubilia Curae; Nulla dapibus dolor vel est. Donec odio justo, sollicitudin ut, suscipit a, feugiat et, eros. Vestibulum ac est lacinia nisi venenatis tristique.",9/1/24
740,260,928,4,Aenean auctor gravida sem. Praesent id massa id nisl venenatis lacinia. Aenean sit amet justo. Morbi ut odio.,10/30/24
741,627,161,2,"Nam nulla. Integer pede justo, lacinia eget, tincidunt eget, tempus vel, pede. Morbi porttitor lorem id ligula. Suspendisse ornare consequat lectus.",1/14/25
742,125,17,1,"Vestibulum ac est lacinia nisi venenatis tristique. Fusce congue, diam id ornare imperdiet, sapien urna pretium nisl, ut volutpat sapien arcu sed augue. Aliquam erat volutpat.",8/27/24
743,164,144,4,"Maecenas tristique, est et tempus semper, est quam pharetra magna, ac consequat metus sapien ut nunc. Vestibulum ante ipsum primis in faucibus orci luctus et ultrices posuere cubilia Curae; Mauris viverra diam vitae quam.",6/4/24
744,897,969,1,"Pellentesque ultrices mattis odio. Donec vitae nisi. Nam ultrices, libero non mattis pulvinar, nulla pede ullamcorper augue, a suscipit nulla elit ac nulla.",5/1/25
745,669,466,4,Praesent blandit lacinia erat. Vestibulum sed magna at nunc commodo placerat.,10/10/24
746,846,937,4,Vestibulum ante ipsum primis in faucibus orci luctus et ultrices posuere cubilia Curae; Mauris viverra diam vitae quam. Suspendisse potenti.,4/27/25
747,821,206,2,"Quisque id justo sit amet sapien dignissim vestibulum. Vestibulum ante ipsum primis in faucibus orci luctus et ultrices posuere cubilia Curae; Nulla dapibus dolor vel est. Donec odio justo, sollicitudin ut, suscipit a, feugiat et, eros.",7/31/24
748,624,922,3,Nulla justo.,6/22/25
749,754,71,1,Nulla mollis molestie lorem. Quisque ut erat. Curabitur gravida nisi at nibh. In hac habitasse platea dictumst.,5/29/24
750,169,954,4,Pellentesque at nulla.,12/6/24
751,163,807,1,Vestibulum ante ipsum primis in faucibus orci luctus et ultrices posuere cubilia Curae; Mauris viverra diam vitae quam. Suspendisse potenti. Nullam porttitor lacus at turpis. Donec posuere metus vitae ipsum.,2/18/25
752,134,355,2,Aliquam non mauris. Morbi non lectus. Aliquam sit amet diam in magna bibendum imperdiet.,5/20/25
753,898,270,3,Sed accumsan felis.,11/4/24
754,312,610,5,"Morbi porttitor lorem id ligula. Suspendisse ornare consequat lectus. In est risus, auctor sed, tristique in, tempus sit amet, sem.",6/10/24
755,301,922,1,Donec ut dolor.,10/29/24
756,900,950,5,Integer a nibh.,2/21/25
757,678,250,5,"Fusce lacus purus, aliquet at, feugiat non, pretium quis, lectus. Suspendisse potenti. In eleifend quam a odio. In hac habitasse platea dictumst.",2/11/25
758,10,772,3,Duis aliquam convallis nunc. Proin at turpis a pede posuere nonummy. Integer non velit.,3/21/25
759,65,138,5,"Donec odio justo, sollicitudin ut, suscipit a, feugiat et, eros.",7/22/24
760,11,260,4,Duis ac nibh.,1/17/25
761,974,234,5,Fusce consequat. Nulla nisl.,6/1/24
762,715,341,5,Vestibulum ante ipsum primis in faucibus orci luctus et ultrices posuere cubilia Curae; Mauris viverra diam vitae quam.,1/30/25
763,617,385,3,Aenean auctor gravida sem.,8/8/24
764,277,535,4,Vivamus tortor. Duis mattis egestas metus. Aenean fermentum. Donec ut mauris eget massa tempor convallis.,8/8/24
765,4,511,4,"Pellentesque ultrices mattis odio. Donec vitae nisi. Nam ultrices, libero non mattis pulvinar, nulla pede ullamcorper augue, a suscipit nulla elit ac nulla. Sed vel enim sit amet nunc viverra dapibus.",6/23/24
766,713,782,5,"Nulla suscipit ligula in lacus. Curabitur at ipsum ac tellus semper interdum. Mauris ullamcorper purus sit amet nulla. Quisque arcu libero, rutrum ac, lobortis vel, dapibus at, diam.",12/17/24
767,277,908,2,Pellentesque eget nunc.,6/22/24
768,857,958,5,"Donec odio justo, sollicitudin ut, suscipit a, feugiat et, eros. Vestibulum ac est lacinia nisi venenatis tristique. Fusce congue, diam id ornare imperdiet, sapien urna pretium nisl, ut volutpat sapien arcu sed augue. Aliquam erat volutpat.",5/23/24
769,9,448,5,Suspendisse potenti.,12/19/24
770,518,36,2,Maecenas ut massa quis augue luctus tincidunt. Nulla mollis molestie lorem.,1/7/25
771,273,414,4,"Nam nulla. Integer pede justo, lacinia eget, tincidunt eget, tempus vel, pede.",5/22/24
772,152,721,3,"Praesent lectus. Vestibulum quam sapien, varius ut, blandit non, interdum in, ante. Vestibulum ante ipsum primis in faucibus orci luctus et ultrices posuere cubilia Curae; Duis faucibus accumsan odio.",8/26/24
773,914,96,5,"Proin risus. Praesent lectus. Vestibulum quam sapien, varius ut, blandit non, interdum in, ante.",11/17/24
774,147,370,3,Suspendisse ornare consequat lectus.,7/18/24
775,374,265,1,"Quisque porta volutpat erat. Quisque erat eros, viverra eget, congue eget, semper rutrum, nulla. Nunc purus.",2/26/25
776,297,455,1,"In est risus, auctor sed, tristique in, tempus sit amet, sem.",7/31/25
777,862,56,4,Nulla mollis molestie lorem. Quisque ut erat. Curabitur gravida nisi at nibh.,10/18/24
778,49,919,4,Nunc nisl.,1/31/25
779,244,310,4,Quisque ut erat. Curabitur gravida nisi at nibh. In hac habitasse platea dictumst.,5/31/24
780,398,931,5,"Nunc nisl. Duis bibendum, felis sed interdum venenatis, turpis enim blandit mi, in porttitor pede justo eu massa. Donec dapibus. Duis at velit eu est congue elementum.",8/27/24
781,834,950,1,In congue. Etiam justo. Etiam pretium iaculis justo.,9/6/24
782,32,477,2,Donec dapibus.,9/16/24
783,646,392,1,"Donec vitae nisi. Nam ultrices, libero non mattis pulvinar, nulla pede ullamcorper augue, a suscipit nulla elit ac nulla. Sed vel enim sit amet nunc viverra dapibus.",9/19/24
784,10,618,1,Maecenas tincidunt lacus at velit. Vivamus vel nulla eget eros elementum pellentesque. Quisque porta volutpat erat.,9/7/24
785,813,91,4,"Mauris enim leo, rhoncus sed, vestibulum sit amet, cursus id, turpis.",3/28/25
786,170,601,3,"In est risus, auctor sed, tristique in, tempus sit amet, sem.",3/5/25
787,143,780,3,Pellentesque at nulla.,2/27/25
788,188,548,1,"Praesent lectus. Vestibulum quam sapien, varius ut, blandit non, interdum in, ante.",5/15/24
789,858,219,2,Suspendisse potenti. Cras in purus eu magna vulputate luctus.,4/5/25
790,865,28,2,Nulla nisl.,2/26/25
791,955,70,5,"Cum sociis natoque penatibus et magnis dis parturient montes, nascetur ridiculus mus. Etiam vel augue. Vestibulum rutrum rutrum neque. Aenean auctor gravida sem.",1/30/25
792,225,688,3,Aenean auctor gravida sem. Praesent id massa id nisl venenatis lacinia.,10/26/24
793,641,474,4,Ut tellus.,10/29/24
794,734,685,2,Aenean auctor gravida sem. Praesent id massa id nisl venenatis lacinia.,5/13/25
795,591,866,1,"Pellentesque viverra pede ac diam. Cras pellentesque volutpat dui. Maecenas tristique, est et tempus semper, est quam pharetra magna, ac consequat metus sapien ut nunc. Vestibulum ante ipsum primis in faucibus orci luctus et ultrices posuere cubilia Curae; Mauris viverra diam vitae quam.",12/22/24
796,236,936,2,"Cum sociis natoque penatibus et magnis dis parturient montes, nascetur ridiculus mus.",8/14/25
797,205,465,5,Aliquam erat volutpat. In congue. Etiam justo. Etiam pretium iaculis justo.,5/10/25
798,888,176,5,Curabitur gravida nisi at nibh.,11/2/24
799,741,257,2,"Cum sociis natoque penatibus et magnis dis parturient montes, nascetur ridiculus mus. Etiam vel augue. Vestibulum rutrum rutrum neque.",6/9/25
800,767,980,4,Nulla suscipit ligula in lacus. Curabitur at ipsum ac tellus semper interdum.,8/8/25
