review_id,user_id,movie_id,rating,comment,created_at
203,574,549,1,"Vestibulum quam sapien, varius ut, blandit non, interdum in, ante. Vestibulum ante ipsum primis in faucibus orci luctus et ultrices posuere cubilia Curae; Duis faucibus accumsan odio. Curabitur convallis.",6/23/24
204,662,262,3,"Curabitur at ipsum ac tellus semper interdum. Mauris ullamcorper purus sit amet nulla. Quisque arcu libero, rutrum ac, lobortis vel, dapibus at, diam.",5/17/24
205,904,877,2,Etiam vel augue.,9/20/24
206,680,645,5,"Suspendisse ornare consequat lectus. In est risus, auctor sed, tristique in, tempus sit amet, sem. Fusce consequat.",8/30/24
207,484,532,2,"Vivamus vestibulum sagittis sapien. Cum sociis natoque penatibus et magnis dis parturient montes, nascetur ridiculus mus. Etiam vel augue. Vestibulum rutrum rutrum neque.",8/8/25
208,796,259,5,"Vestibulum quam sapien, varius ut, blandit non, interdum in, ante.",8/25/24
209,8,850,5,"Lorem ipsum dolor sit amet, consectetuer adipiscing elit. Proin risus.",6/16/25
210,234,56,3,Nullam porttitor lacus at turpis. Donec posuere metus vitae ipsum. Aliquam non mauris.,9/27/24
211,90,892,5,Ut tellus.,8/30/24
212,870,40,3,Sed ante.,9/30/24
213,231,923,5,Curabitur at ipsum ac tellus semper interdum.,10/3/24
214,748,222,4,Praesent id massa id nisl venenatis lacinia.,7/12/24
215,494,753,2,"Duis bibendum, felis sed interdum venenatis, turpis enim blandit mi, in porttitor pede justo eu massa.",7/24/24
216,155,557,3,Ut at dolor quis odio consequat varius. Integer ac leo. Pellentesque ultrices mattis odio. Donec vitae nisi.,6/9/25
217,38,651,3,"Vestibulum ac est lacinia nisi venenatis tristique. Fusce congue, diam id ornare imperdiet, sapien urna pretium nisl, ut volutpat sapien arcu sed augue. Aliquam erat volutpat.",7/20/25
218,452,126,1,Nulla tempus. Vivamus in felis eu sapien cursus vestibulum. Proin eu mi.,1/5/25
219,301,252,1,"In quis justo. Maecenas rhoncus aliquam lacus. Morbi quis tortor id nulla ultrices aliquet. Maecenas leo odio, condimentum id, luctus nec, molestie sed, justo.",7/19/24
220,109,290,5,Cras non velit nec nisi vulputate nonummy. Maecenas tincidunt lacus at velit.,4/5/25
221,594,157,3,Nullam sit amet turpis elementum ligula vehicula consequat. Morbi a ipsum. Integer a nibh.,1/22/25
222,676,800,3,Proin eu mi.,1/8/25
223,3,406,2,"Nulla neque libero, convallis eget, eleifend luctus, ultricies eu, nibh. Quisque id justo sit amet sapien dignissim vestibulum. Vestibulum ante ipsum primis in faucibus orci luctus et ultrices posuere cubilia Curae; Nulla dapibus dolor vel est.",9/5/24
224,306,60,4,"Integer non velit. Donec diam neque, vestibulum eget, vulputate ut, ultrices vel, augue.",9/24/24
225,121,73,1,"Praesent lectus. Vestibulum quam sapien, varius ut, blandit non, interdum in, ante. Vestibulum ante ipsum primis in faucibus orci luctus et ultrices posuere cubilia Curae; Duis faucibus accumsan odio.",6/24/25
226,444,12,1,Ut at dolor quis odio consequat varius. Integer ac leo. Pellentesque ultrices mattis odio.,4/29/25
227,666,797,1,Sed vel enim sit amet nunc viverra dapibus. Nulla suscipit ligula in lacus. Curabitur at ipsum ac tellus semper interdum. Mauris ullamcorper purus sit amet nulla.,9/1/24
228,943,812,2,"Quisque arcu libero, rutrum ac, lobortis vel, dapibus at, diam. Nam tristique tortor eu pede.",6/6/24
229,851,588,4,"Cum sociis natoque penatibus et magnis dis parturient montes, nascetur ridiculus mus. Vivamus vestibulum sagittis sapien. Cum sociis natoque penatibus et magnis dis parturient montes, nascetur ridiculus mus.",11/16/24
230,94,676,2,"Vestibulum ante ipsum primis in faucibus orci luctus et ultrices posuere cubilia Curae; Nulla dapibus dolor vel est. Donec odio justo, sollicitudin ut, suscipit a, feugiat et, eros. Vestibulum ac est lacinia nisi venenatis tristique.",9/3/24
231,802,954,3,"Nullam orci pede, venenatis non, sodales sed, tincidunt eu, felis. Fusce posuere felis sed lacus. Morbi sem mauris, laoreet ut, rhoncus aliquet, pulvinar sed, nisl.",3/4/25
232,152,248,1,"Nam ultrices, libero non mattis pulvinar, nulla pede ullamcorper augue, a suscipit nulla elit ac nulla. Sed vel enim sit amet nunc viverra dapibus. Nulla suscipit ligula in lacus.",11/17/24
233,448,551,5,"Duis mattis egestas metus. Aenean fermentum. Donec ut mauris eget massa tempor convallis. Nulla neque libero, convallis eget, eleifend luctus, ultricies eu, nibh.",6/10/25
234,343,139,3,Praesent blandit lacinia erat.,8/30/24
235,657,501,3,"Donec dapibus. Duis at velit eu est congue elementum. In hac habitasse platea dictumst. Morbi vestibulum, velit id pretium iaculis, diam erat fermentum justo, nec condimentum neque sapien placerat ante.",8/8/25
236,967,968,5,Vestibulum ante ipsum primis in faucibus orci luctus et ultrices posuere cubilia Curae; Nulla dapibus dolor vel est.,10/5/24
237,246,955,1,"Nam ultrices, libero non mattis pulvinar, nulla pede ullamcorper augue, a suscipit nulla elit ac nulla. Sed vel enim sit amet nunc viverra dapibus. Nulla suscipit ligula in lacus.",10/29/24
238,921,652,2,"Morbi quis tortor id nulla ultrices aliquet. Maecenas leo odio, condimentum id, luctus nec, molestie sed, justo.",8/28/24
239,137,662,3,"Quisque porta volutpat erat. Quisque erat eros, viverra eget, congue eget, semper rutrum, nulla. Nunc purus.",6/23/24
240,651,368,3,"Proin at turpis a pede posuere nonummy. Integer non velit. Donec diam neque, vestibulum eget, vulputate ut, ultrices vel, augue. Vestibulum ante ipsum primis in faucibus orci luctus et ultrices posuere cubilia Curae; Donec pharetra, magna vestibulum aliquet ultrices, erat tortor sollicitudin mi, sit amet lobortis sapien sapien non mi.",11/6/24
241,884,152,5,Vestibulum rutrum rutrum neque. Aenean auctor gravida sem. Praesent id massa id nisl venenatis lacinia.,6/14/24
242,577,575,3,"Nam nulla. Integer pede justo, lacinia eget, tincidunt eget, tempus vel, pede.",1/24/25
243,129,28,3,Suspendisse potenti. Nullam porttitor lacus at turpis. Donec posuere metus vitae ipsum. Aliquam non mauris.,9/29/24
244,526,836,2,Suspendisse accumsan tortor quis turpis.,1/18/25
245,314,169,5,"Mauris enim leo, rhoncus sed, vestibulum sit amet, cursus id, turpis. Integer aliquet, massa id lobortis convallis, tortor risus dapibus augue, vel accumsan tellus nisi eu orci.",8/6/25
246,370,148,5,"Fusce lacus purus, aliquet at, feugiat non, pretium quis, lectus.",6/5/25
247,304,236,3,Donec posuere metus vitae ipsum. Aliquam non mauris. Morbi non lectus.,1/15/25
248,154,508,1,"Cras in purus eu magna vulputate luctus. Cum sociis natoque penatibus et magnis dis parturient montes, nascetur ridiculus mus. Vivamus vestibulum sagittis sapien.",12/6/24
249,902,250,5,Aenean lectus. Pellentesque eget nunc. Donec quis orci eget orci vehicula condimentum. Curabitur in libero ut massa volutpat convallis.,1/22/25
250,736,316,3,Ut at dolor quis odio consequat varius. Integer ac leo. Pellentesque ultrices mattis odio.,5/17/24
251,920,195,5,"Fusce lacus purus, aliquet at, feugiat non, pretium quis, lectus. Suspendisse potenti. In eleifend quam a odio.",5/26/25
252,816,557,3,Vestibulum ac est lacinia nisi venenatis tristique.,6/3/24
253,54,268,2,"Nam congue, risus semper porta volutpat, quam pede lobortis ligula, sit amet eleifend pede libero quis orci. Nullam molestie nibh in lectus. Pellentesque at nulla. Suspendisse potenti.",2/18/25
254,801,498,3,Nullam porttitor lacus at turpis. Donec posuere metus vitae ipsum. Aliquam non mauris. Morbi non lectus.,2/17/25
255,474,310,3,Integer ac neque. Duis bibendum.,6/12/24
256,734,730,1,Nulla ac enim.,10/18/24
257,550,733,3,Nullam sit amet turpis elementum ligula vehicula consequat. Morbi a ipsum. Integer a nibh. In quis justo.,1/8/25
258,418,857,2,Curabitur gravida nisi at nibh.,1/27/25
259,731,377,3,"Duis at velit eu est congue elementum. In hac habitasse platea dictumst. Morbi vestibulum, velit id pretium iaculis, diam erat fermentum justo, nec condimentum neque sapien placerat ante. Nulla justo.",3/24/25
260,44,609,3,"Praesent lectus. Vestibulum quam sapien, varius ut, blandit non, interdum in, ante. Vestibulum ante ipsum primis in faucibus orci luctus et ultrices posuere cubilia Curae; Duis faucibus accumsan odio.",1/22/25
261,888,835,1,Praesent id massa id nisl venenatis lacinia.,5/30/25
262,424,46,3,"Donec ut dolor. Morbi vel lectus in quam fringilla rhoncus. Mauris enim leo, rhoncus sed, vestibulum sit amet, cursus id, turpis. Integer aliquet, massa id lobortis convallis, tortor risus dapibus augue, vel accumsan tellus nisi eu orci.",1/1/25
263,293,313,2,Morbi porttitor lorem id ligula. Suspendisse ornare consequat lectus.,6/14/25
264,850,864,4,"Donec diam neque, vestibulum eget, vulputate ut, ultrices vel, augue. Vestibulum ante ipsum primis in faucibus orci luctus et ultrices posuere cubilia Curae; Donec pharetra, magna vestibulum aliquet ultrices, erat tortor sollicitudin mi, sit amet lobortis sapien sapien non mi. Integer ac neque. Duis bibendum.",5/9/25
265,165,830,1,Aliquam erat volutpat. In congue. Etiam justo. Etiam pretium iaculis justo.,10/2/24
266,352,349,5,"Cras pellentesque volutpat dui. Maecenas tristique, est et tempus semper, est quam pharetra magna, ac consequat metus sapien ut nunc. Vestibulum ante ipsum primis in faucibus orci luctus et ultrices posuere cubilia Curae; Mauris viverra diam vitae quam.",7/24/24
267,419,525,2,Suspendisse accumsan tortor quis turpis. Sed ante. Vivamus tortor. Duis mattis egestas metus.,9/12/24
268,383,989,1,Morbi porttitor lorem id ligula. Suspendisse ornare consequat lectus.,11/30/24
269,811,176,2,"Curabitur gravida nisi at nibh. In hac habitasse platea dictumst. Aliquam augue quam, sollicitudin vitae, consectetuer eget, rutrum at, lorem.",6/13/24
270,761,609,1,Sed ante.,9/25/24
271,7,153,1,Suspendisse potenti. In eleifend quam a odio. In hac habitasse platea dictumst. Maecenas ut massa quis augue luctus tincidunt.,11/29/24
272,283,100,3,"Morbi vestibulum, velit id pretium iaculis, diam erat fermentum justo, nec condimentum neque sapien placerat ante. Nulla justo. Aliquam quis turpis eget elit sodales scelerisque.",3/6/25
273,557,193,3,"Curabitur at ipsum ac tellus semper interdum. Mauris ullamcorper purus sit amet nulla. Quisque arcu libero, rutrum ac, lobortis vel, dapibus at, diam.",8/28/24
274,435,431,3,"Nam ultrices, libero non mattis pulvinar, nulla pede ullamcorper augue, a suscipit nulla elit ac nulla. Sed vel enim sit amet nunc viverra dapibus. Nulla suscipit ligula in lacus. Curabitur at ipsum ac tellus semper interdum.",11/4/24
275,849,949,1,"Aenean sit amet justo. Morbi ut odio. Cras mi pede, malesuada in, imperdiet et, commodo vulputate, justo.",5/20/24
276,887,618,4,In hac habitasse platea dictumst. Maecenas ut massa quis augue luctus tincidunt. Nulla mollis molestie lorem. Quisque ut erat.,3/13/25
277,938,878,4,Phasellus sit amet erat.,11/20/24
278,888,106,3,"Curabitur gravida nisi at nibh. In hac habitasse platea dictumst. Aliquam augue quam, sollicitudin vitae, consectetuer eget, rutrum at, lorem.",2/28/25
279,609,164,5,Nulla justo. Aliquam quis turpis eget elit sodales scelerisque. Mauris sit amet eros. Suspendisse accumsan tortor quis turpis.,5/1/25
280,826,109,5,"Morbi porttitor lorem id ligula. Suspendisse ornare consequat lectus. In est risus, auctor sed, tristique in, tempus sit amet, sem. Fusce consequat.",9/9/24
281,489,823,3,Vestibulum ante ipsum primis in faucibus orci luctus et ultrices posuere cubilia Curae; Duis faucibus accumsan odio. Curabitur convallis. Duis consequat dui nec nisi volutpat eleifend.,9/16/24
282,400,969,3,"Fusce congue, diam id ornare imperdiet, sapien urna pretium nisl, ut volutpat sapien arcu sed augue. Aliquam erat volutpat. In congue. Etiam justo.",4/7/25
283,997,460,3,Phasellus sit amet erat. Nulla tempus. Vivamus in felis eu sapien cursus vestibulum.,5/15/25
284,432,390,5,Aenean auctor gravida sem.,5/25/24
285,528,195,4,"Maecenas tristique, est et tempus semper, est quam pharetra magna, ac consequat metus sapien ut nunc. Vestibulum ante ipsum primis in faucibus orci luctus et ultrices posuere cubilia Curae; Mauris viverra diam vitae quam.",1/9/25
286,422,637,1,"Sed sagittis. Nam congue, risus semper porta volutpat, quam pede lobortis ligula, sit amet eleifend pede libero quis orci.",5/10/25
287,325,355,5,Vivamus tortor. Duis mattis egestas metus. Aenean fermentum.,5/20/25
288,739,968,3,"Pellentesque ultrices mattis odio. Donec vitae nisi. Nam ultrices, libero non mattis pulvinar, nulla pede ullamcorper augue, a suscipit nulla elit ac nulla. Sed vel enim sit amet nunc viverra dapibus.",11/12/24
289,975,550,4,Quisque porta volutpat erat.,7/24/25
290,904,307,2,"Integer ac leo. Pellentesque ultrices mattis odio. Donec vitae nisi. Nam ultrices, libero non mattis pulvinar, nulla pede ullamcorper augue, a suscipit nulla elit ac nulla.",4/3/25
291,693,98,4,"Fusce congue, diam id ornare imperdiet, sapien urna pretium nisl, ut volutpat sapien arcu sed augue.",9/13/24
292,592,913,4,"Nullam orci pede, venenatis non, sodales sed, tincidunt eu, felis. Fusce posuere felis sed lacus. Morbi sem mauris, laoreet ut, rhoncus aliquet, pulvinar sed, nisl. Nunc rhoncus dui vel sem.",6/28/25
293,668,302,4,"In quis justo. Maecenas rhoncus aliquam lacus. Morbi quis tortor id nulla ultrices aliquet. Maecenas leo odio, condimentum id, luctus nec, molestie sed, justo.",11/21/24
294,788,666,5,"In tempor, turpis nec euismod scelerisque, quam turpis adipiscing lorem, vitae mattis nibh ligula nec sem.",6/24/24
295,468,565,2,"Nam ultrices, libero non mattis pulvinar, nulla pede ullamcorper augue, a suscipit nulla elit ac nulla. Sed vel enim sit amet nunc viverra dapibus. Nulla suscipit ligula in lacus.",11/8/24
296,593,489,2,"Morbi porttitor lorem id ligula. Suspendisse ornare consequat lectus. In est risus, auctor sed, tristique in, tempus sit amet, sem.",7/29/25
297,622,50,1,Pellentesque ultrices mattis odio.,5/8/25
298,661,756,5,"Nulla neque libero, convallis eget, eleifend luctus, ultricies eu, nibh. Quisque id justo sit amet sapien dignissim vestibulum. Vestibulum ante ipsum primis in faucibus orci luctus et ultrices posuere cubilia Curae; Nulla dapibus dolor vel est. Donec odio justo, sollicitudin ut, suscipit a, feugiat et, eros.",10/4/24
299,190,756,5,"Aliquam sit amet diam in magna bibendum imperdiet. Nullam orci pede, venenatis non, sodales sed, tincidunt eu, felis. Fusce posuere felis sed lacus. Morbi sem mauris, laoreet ut, rhoncus aliquet, pulvinar sed, nisl.",1/5/25
300,856,491,5,Etiam pretium iaculis justo. In hac habitasse platea dictumst. Etiam faucibus cursus urna.,11/17/24
301,778,74,4,Etiam vel augue. Vestibulum rutrum rutrum neque. Aenean auctor gravida sem. Praesent id massa id nisl venenatis lacinia.,7/10/24
302,878,488,2,Curabitur at ipsum ac tellus semper interdum.,3/23/25
303,430,347,2,Suspendisse potenti. In eleifend quam a odio. In hac habitasse platea dictumst. Maecenas ut massa quis augue luctus tincidunt.,2/16/25
304,635,692,1,Nulla tempus. Vivamus in felis eu sapien cursus vestibulum.,6/7/25
305,112,236,1,"Maecenas tincidunt lacus at velit. Vivamus vel nulla eget eros elementum pellentesque. Quisque porta volutpat erat. Quisque erat eros, viverra eget, congue eget, semper rutrum, nulla.",7/11/25
306,385,117,5,"Nulla ac enim. In tempor, turpis nec euismod scelerisque, quam turpis adipiscing lorem, vitae mattis nibh ligula nec sem. Duis aliquam convallis nunc.",1/21/25
307,418,274,3,"Sed sagittis. Nam congue, risus semper porta volutpat, quam pede lobortis ligula, sit amet eleifend pede libero quis orci. Nullam molestie nibh in lectus. Pellentesque at nulla.",5/28/24
308,3,140,5,"Maecenas leo odio, condimentum id, luctus nec, molestie sed, justo. Pellentesque viverra pede ac diam. Cras pellentesque volutpat dui. Maecenas tristique, est et tempus semper, est quam pharetra magna, ac consequat metus sapien ut nunc.",1/1/25
309,270,626,3,"Curabitur in libero ut massa volutpat convallis. Morbi odio odio, elementum eu, interdum eu, tincidunt in, leo.",5/27/24
310,851,354,3,"Nullam orci pede, venenatis non, sodales sed, tincidunt eu, felis.",1/22/25
311,999,404,4,Vivamus in felis eu sapien cursus vestibulum. Proin eu mi. Nulla ac enim.,6/13/24
312,609,699,3,"Nunc nisl. Duis bibendum, felis sed interdum venenatis, turpis enim blandit mi, in porttitor pede justo eu massa. Donec dapibus. Duis at velit eu est congue elementum.",8/16/25
313,719,40,5,Vestibulum sed magna at nunc commodo placerat. Praesent blandit.,8/10/24
314,660,98,3,"Aliquam augue quam, sollicitudin vitae, consectetuer eget, rutrum at, lorem.",5/22/25
315,636,626,1,"Lorem ipsum dolor sit amet, consectetuer adipiscing elit. Proin interdum mauris non ligula pellentesque ultrices. Phasellus id sapien in sapien iaculis congue. Vivamus metus arcu, adipiscing molestie, hendrerit at, vulputate vitae, nisl.",5/16/25
316,372,475,5,Nullam sit amet turpis elementum ligula vehicula consequat. Morbi a ipsum. Integer a nibh.,6/23/24
317,983,651,3,"Nulla ac enim. In tempor, turpis nec euismod scelerisque, quam turpis adipiscing lorem, vitae mattis nibh ligula nec sem.",7/30/25
318,949,908,5,Morbi non quam nec dui luctus rutrum.,7/21/25
319,515,763,5,Morbi a ipsum. Integer a nibh.,12/8/24
320,602,984,3,Proin risus. Praesent lectus.,5/17/24
321,883,182,1,"Integer aliquet, massa id lobortis convallis, tortor risus dapibus augue, vel accumsan tellus nisi eu orci. Mauris lacinia sapien quis libero. Nullam sit amet turpis elementum ligula vehicula consequat.",4/12/25
322,177,946,3,"Maecenas leo odio, condimentum id, luctus nec, molestie sed, justo. Pellentesque viverra pede ac diam. Cras pellentesque volutpat dui.",4/10/25
323,344,981,3,Sed ante. Vivamus tortor. Duis mattis egestas metus. Aenean fermentum.,6/16/24
324,926,118,4,"Maecenas rhoncus aliquam lacus. Morbi quis tortor id nulla ultrices aliquet. Maecenas leo odio, condimentum id, luctus nec, molestie sed, justo. Pellentesque viverra pede ac diam.",1/25/25
325,60,963,2,Duis aliquam convallis nunc. Proin at turpis a pede posuere nonummy.,3/14/25
326,309,344,4,"Pellentesque ultrices mattis odio. Donec vitae nisi. Nam ultrices, libero non mattis pulvinar, nulla pede ullamcorper augue, a suscipit nulla elit ac nulla. Sed vel enim sit amet nunc viverra dapibus.",1/23/25
327,250,274,1,"Vestibulum ante ipsum primis in faucibus orci luctus et ultrices posuere cubilia Curae; Donec pharetra, magna vestibulum aliquet ultrices, erat tortor sollicitudin mi, sit amet lobortis sapien sapien non mi. Integer ac neque. Duis bibendum. Morbi non quam nec dui luctus rutrum.",8/2/24
328,560,193,3,Morbi porttitor lorem id ligula.,3/15/25
329,849,36,2,"Proin interdum mauris non ligula pellentesque ultrices. Phasellus id sapien in sapien iaculis congue. Vivamus metus arcu, adipiscing molestie, hendrerit at, vulputate vitae, nisl. Aenean lectus.",1/17/25
330,792,453,4,"Maecenas rhoncus aliquam lacus. Morbi quis tortor id nulla ultrices aliquet. Maecenas leo odio, condimentum id, luctus nec, molestie sed, justo.",4/5/25
331,825,469,4,Donec posuere metus vitae ipsum. Aliquam non mauris. Morbi non lectus. Aliquam sit amet diam in magna bibendum imperdiet.,7/5/24
332,610,424,3,Sed ante. Vivamus tortor. Duis mattis egestas metus.,5/31/24
333,612,439,1,"Nunc rhoncus dui vel sem. Sed sagittis. Nam congue, risus semper porta volutpat, quam pede lobortis ligula, sit amet eleifend pede libero quis orci.",8/23/24
334,589,763,5,Aliquam erat volutpat.,12/13/24
335,136,156,2,In eleifend quam a odio. In hac habitasse platea dictumst.,3/27/25
336,373,853,3,Suspendisse potenti. Cras in purus eu magna vulputate luctus.,8/5/24
337,874,949,2,Suspendisse potenti. In eleifend quam a odio. In hac habitasse platea dictumst. Maecenas ut massa quis augue luctus tincidunt.,6/13/24
338,898,653,1,Sed sagittis.,3/10/25
339,175,233,4,In eleifend quam a odio. In hac habitasse platea dictumst.,8/21/24
340,977,522,5,Aliquam quis turpis eget elit sodales scelerisque. Mauris sit amet eros.,5/31/25
341,55,521,3,"Morbi odio odio, elementum eu, interdum eu, tincidunt in, leo. Maecenas pulvinar lobortis est. Phasellus sit amet erat. Nulla tempus.",6/26/24
342,55,619,3,"Curabitur in libero ut massa volutpat convallis. Morbi odio odio, elementum eu, interdum eu, tincidunt in, leo. Maecenas pulvinar lobortis est.",8/11/24
343,946,289,3,"Vestibulum ante ipsum primis in faucibus orci luctus et ultrices posuere cubilia Curae; Donec pharetra, magna vestibulum aliquet ultrices, erat tortor sollicitudin mi, sit amet lobortis sapien sapien non mi. Integer ac neque.",9/11/24
344,544,122,2,Suspendisse accumsan tortor quis turpis.,7/14/24
345,66,927,2,Nulla justo. Aliquam quis turpis eget elit sodales scelerisque.,9/6/24
346,470,763,5,Vivamus vel nulla eget eros elementum pellentesque.,4/20/25
347,645,24,2,"Integer non velit. Donec diam neque, vestibulum eget, vulputate ut, ultrices vel, augue. Vestibulum ante ipsum primis in faucibus orci luctus et ultrices posuere cubilia Curae; Donec pharetra, magna vestibulum aliquet ultrices, erat tortor sollicitudin mi, sit amet lobortis sapien sapien non mi. Integer ac neque.",9/29/24
348,601,673,5,"Morbi odio odio, elementum eu, interdum eu, tincidunt in, leo. Maecenas pulvinar lobortis est. Phasellus sit amet erat. Nulla tempus.",12/18/24
349,73,437,4,"Nullam orci pede, venenatis non, sodales sed, tincidunt eu, felis.",12/27/24
350,982,605,2,"Morbi porttitor lorem id ligula. Suspendisse ornare consequat lectus. In est risus, auctor sed, tristique in, tempus sit amet, sem.",10/30/24
351,977,598,2,"Cras mi pede, malesuada in, imperdiet et, commodo vulputate, justo. In blandit ultrices enim. Lorem ipsum dolor sit amet, consectetuer adipiscing elit. Proin interdum mauris non ligula pellentesque ultrices.",7/31/24
352,254,85,4,"Morbi sem mauris, laoreet ut, rhoncus aliquet, pulvinar sed, nisl. Nunc rhoncus dui vel sem. Sed sagittis.",8/2/24
353,144,638,1,"Curabitur at ipsum ac tellus semper interdum. Mauris ullamcorper purus sit amet nulla. Quisque arcu libero, rutrum ac, lobortis vel, dapibus at, diam.",5/25/24
354,74,148,4,"Duis aliquam convallis nunc. Proin at turpis a pede posuere nonummy. Integer non velit. Donec diam neque, vestibulum eget, vulputate ut, ultrices vel, augue.",4/27/25
355,302,694,4,Vestibulum ante ipsum primis in faucibus orci luctus et ultrices posuere cubilia Curae; Duis faucibus accumsan odio. Curabitur convallis. Duis consequat dui nec nisi volutpat eleifend. Donec ut dolor.,5/13/25
356,125,487,5,Phasellus id sapien in sapien iaculis congue.,6/30/25
357,250,349,3,"Lorem ipsum dolor sit amet, consectetuer adipiscing elit. Proin interdum mauris non ligula pellentesque ultrices.",1/6/25
358,117,899,1,"Cum sociis natoque penatibus et magnis dis parturient montes, nascetur ridiculus mus. Etiam vel augue. Vestibulum rutrum rutrum neque.",5/18/24
359,440,965,3,"Morbi ut odio. Cras mi pede, malesuada in, imperdiet et, commodo vulputate, justo. In blandit ultrices enim.",9/21/24
360,840,28,4,"Aenean fermentum. Donec ut mauris eget massa tempor convallis. Nulla neque libero, convallis eget, eleifend luctus, ultricies eu, nibh. Quisque id justo sit amet sapien dignissim vestibulum.",4/7/25
361,761,678,3,In hac habitasse platea dictumst.,8/16/24
362,920,250,3,"Vivamus metus arcu, adipiscing molestie, hendrerit at, vulputate vitae, nisl. Aenean lectus. Pellentesque eget nunc.",8/17/24
363,687,389,3,"Quisque ut erat. Curabitur gravida nisi at nibh. In hac habitasse platea dictumst. Aliquam augue quam, sollicitudin vitae, consectetuer eget, rutrum at, lorem.",10/12/24
364,742,927,1,"Vivamus in felis eu sapien cursus vestibulum. Proin eu mi. Nulla ac enim. In tempor, turpis nec euismod scelerisque, quam turpis adipiscing lorem, vitae mattis nibh ligula nec sem.",6/12/25
365,546,423,3,Nulla mollis molestie lorem. Quisque ut erat. Curabitur gravida nisi at nibh.,7/20/25
366,861,404,4,"Fusce posuere felis sed lacus. Morbi sem mauris, laoreet ut, rhoncus aliquet, pulvinar sed, nisl. Nunc rhoncus dui vel sem. Sed sagittis.",10/30/24
367,114,610,1,"Morbi vel lectus in quam fringilla rhoncus. Mauris enim leo, rhoncus sed, vestibulum sit amet, cursus id, turpis. Integer aliquet, massa id lobortis convallis, tortor risus dapibus augue, vel accumsan tellus nisi eu orci. Mauris lacinia sapien quis libero.",5/7/25
368,822,565,2,Donec dapibus. Duis at velit eu est congue elementum.,1/22/25
369,217,301,4,"Nam ultrices, libero non mattis pulvinar, nulla pede ullamcorper augue, a suscipit nulla elit ac nulla. Sed vel enim sit amet nunc viverra dapibus.",6/4/24
370,252,189,2,"Maecenas leo odio, condimentum id, luctus nec, molestie sed, justo. Pellentesque viverra pede ac diam.",12/15/24
371,984,450,5,Morbi quis tortor id nulla ultrices aliquet.,4/3/25
372,656,787,1,"Nullam orci pede, venenatis non, sodales sed, tincidunt eu, felis. Fusce posuere felis sed lacus. Morbi sem mauris, laoreet ut, rhoncus aliquet, pulvinar sed, nisl. Nunc rhoncus dui vel sem.",9/26/24
373,457,21,3,"Cras mi pede, malesuada in, imperdiet et, commodo vulputate, justo.",4/6/25
374,326,554,4,"Donec quis orci eget orci vehicula condimentum. Curabitur in libero ut massa volutpat convallis. Morbi odio odio, elementum eu, interdum eu, tincidunt in, leo.",3/15/25
375,44,409,5,"Suspendisse potenti. Cras in purus eu magna vulputate luctus. Cum sociis natoque penatibus et magnis dis parturient montes, nascetur ridiculus mus.",1/31/25
376,171,525,3,Integer ac leo. Pellentesque ultrices mattis odio.,8/14/25
377,594,814,3,"Cum sociis natoque penatibus et magnis dis parturient montes, nascetur ridiculus mus. Etiam vel augue. Vestibulum rutrum rutrum neque. Aenean auctor gravida sem.",8/1/25
378,421,498,2,Vivamus tortor. Duis mattis egestas metus. Aenean fermentum.,6/9/25
379,624,934,4,"Aliquam sit amet diam in magna bibendum imperdiet. Nullam orci pede, venenatis non, sodales sed, tincidunt eu, felis. Fusce posuere felis sed lacus. Morbi sem mauris, laoreet ut, rhoncus aliquet, pulvinar sed, nisl.",6/26/25
