review_id,user_id,movie_id,rating,comment,created_at
1,115,891,1,"Maecenas tristique, est et tempus semper, est quam pharetra magna, ac consequat metus sapien ut nunc. Vestibulum ante ipsum primis in faucibus orci luctus et ultrices posuere cubilia Curae; Mauris viverra diam vitae quam. Suspendisse potenti. Nullam porttitor lacus at turpis.",7/16/24
2,172,152,3,"Duis ac nibh. Fusce lacus purus, aliquet at, feugiat non, pretium quis, lectus. Suspendisse potenti. In eleifend quam a odio.",3/5/25
3,275,677,3,"Nam dui. Proin leo odio, porttitor id, consequat in, consequat ut, nulla. Sed accumsan felis. Ut at dolor quis odio consequat varius.",7/6/24
4,79,707,1,"Integer non velit. Donec diam neque, vestibulum eget, vulputate ut, ultrices vel, augue.",8/13/25
5,879,123,4,Morbi a ipsum.,1/2/25
6,441,717,1,Donec posuere metus vitae ipsum. Aliquam non mauris. Morbi non lectus. Aliquam sit amet diam in magna bibendum imperdiet.,12/18/24
7,706,953,3,"Morbi vel lectus in quam fringilla rhoncus. Mauris enim leo, rhoncus sed, vestibulum sit amet, cursus id, turpis. Integer aliquet, massa id lobortis convallis, tortor risus dapibus augue, vel accumsan tellus nisi eu orci.",8/12/24
8,716,30,2,Phasellus in felis. Donec semper sapien a libero.,11/1/24
9,762,144,2,"Maecenas leo odio, condimentum id, luctus nec, molestie sed, justo. Pellentesque viverra pede ac diam. Cras pellentesque volutpat dui.",3/8/25
10,837,822,3,"In tempor, turpis nec euismod scelerisque, quam turpis adipiscing lorem, vitae mattis nibh ligula nec sem. Duis aliquam convallis nunc. Proin at turpis a pede posuere nonummy. Integer non velit.",4/25/25
11,61,388,3,"Fusce posuere felis sed lacus. Morbi sem mauris, laoreet ut, rhoncus aliquet, pulvinar sed, nisl. Nunc rhoncus dui vel sem. Sed sagittis.",3/12/25
12,452,438,3,Vestibulum ante ipsum primis in faucibus orci luctus et ultrices posuere cubilia Curae; Duis faucibus accumsan odio. Curabitur convallis. Duis consequat dui nec nisi volutpat eleifend. Donec ut dolor.,2/23/25
13,69,266,3,"Morbi ut odio. Cras mi pede, malesuada in, imperdiet et, commodo vulputate, justo.",11/28/24
14,440,303,4,Maecenas tincidunt lacus at velit. Vivamus vel nulla eget eros elementum pellentesque.,6/25/25
15,665,988,4,"Lorem ipsum dolor sit amet, consectetuer adipiscing elit. Proin interdum mauris non ligula pellentesque ultrices.",7/22/25
16,173,126,5,Pellentesque viverra pede ac diam.,3/20/25
17,9,343,5,Vestibulum ante ipsum primis in faucibus orci luctus et ultrices posuere cubilia Curae; Nulla dapibus dolor vel est.,7/14/24
18,777,641,4,Etiam vel augue.,12/19/24
19,724,133,3,Nulla facilisi. Cras non velit nec nisi vulputate nonummy. Maecenas tincidunt lacus at velit.,5/13/25
20,517,970,4,"Vestibulum ante ipsum primis in faucibus orci luctus et ultrices posuere cubilia Curae; Nulla dapibus dolor vel est. Donec odio justo, sollicitudin ut, suscipit a, feugiat et, eros.",2/9/25
21,742,260,4,Nulla facilisi. Cras non velit nec nisi vulputate nonummy. Maecenas tincidunt lacus at velit.,6/9/25
22,141,84,3,Praesent blandit lacinia erat. Vestibulum sed magna at nunc commodo placerat. Praesent blandit. Nam nulla.,11/7/24
23,720,20,5,Nulla suscipit ligula in lacus. Curabitur at ipsum ac tellus semper interdum.,3/5/25
24,446,454,5,"Sed sagittis. Nam congue, risus semper porta volutpat, quam pede lobortis ligula, sit amet eleifend pede libero quis orci. Nullam molestie nibh in lectus. Pellentesque at nulla.",7/17/25
25,257,745,1,"Proin risus. Praesent lectus. Vestibulum quam sapien, varius ut, blandit non, interdum in, ante. Vestibulum ante ipsum primis in faucibus orci luctus et ultrices posuere cubilia Curae; Duis faucibus accumsan odio.",12/3/24
26,303,303,5,In eleifend quam a odio. In hac habitasse platea dictumst. Maecenas ut massa quis augue luctus tincidunt. Nulla mollis molestie lorem.,6/21/25
27,800,502,1,"Cum sociis natoque penatibus et magnis dis parturient montes, nascetur ridiculus mus.",7/25/25
28,643,263,1,Phasellus sit amet erat. Nulla tempus. Vivamus in felis eu sapien cursus vestibulum.,4/13/25
29,232,711,2,"Mauris enim leo, rhoncus sed, vestibulum sit amet, cursus id, turpis. Integer aliquet, massa id lobortis convallis, tortor risus dapibus augue, vel accumsan tellus nisi eu orci. Mauris lacinia sapien quis libero.",8/26/24
30,729,825,4,Mauris sit amet eros. Suspendisse accumsan tortor quis turpis. Sed ante.,5/22/24
31,238,535,5,"Vestibulum ante ipsum primis in faucibus orci luctus et ultrices posuere cubilia Curae; Donec pharetra, magna vestibulum aliquet ultrices, erat tortor sollicitudin mi, sit amet lobortis sapien sapien non mi.",9/18/24
32,357,468,5,"Integer non velit. Donec diam neque, vestibulum eget, vulputate ut, ultrices vel, augue. Vestibulum ante ipsum primis in faucibus orci luctus et ultrices posuere cubilia Curae; Donec pharetra, magna vestibulum aliquet ultrices, erat tortor sollicitudin mi, sit amet lobortis sapien sapien non mi. Integer ac neque.",8/29/24
33,122,565,4,Vestibulum ac est lacinia nisi venenatis tristique.,11/28/24
34,255,750,3,Integer a nibh. In quis justo.,9/7/24
35,547,66,1,"In tempor, turpis nec euismod scelerisque, quam turpis adipiscing lorem, vitae mattis nibh ligula nec sem. Duis aliquam convallis nunc. Proin at turpis a pede posuere nonummy.",10/23/24
36,763,378,3,In hac habitasse platea dictumst. Etiam faucibus cursus urna. Ut tellus. Nulla ut erat id mauris vulputate elementum.,1/28/25
37,343,751,1,Phasellus sit amet erat. Nulla tempus. Vivamus in felis eu sapien cursus vestibulum.,9/7/24
38,955,922,3,"Fusce posuere felis sed lacus. Morbi sem mauris, laoreet ut, rhoncus aliquet, pulvinar sed, nisl.",6/25/24
39,685,419,4,Praesent blandit.,8/5/25
40,16,723,2,Morbi a ipsum. Integer a nibh.,7/24/24
41,906,850,2,"Fusce congue, diam id ornare imperdiet, sapien urna pretium nisl, ut volutpat sapien arcu sed augue. Aliquam erat volutpat. In congue. Etiam justo.",12/31/24
42,99,908,3,Ut tellus. Nulla ut erat id mauris vulputate elementum. Nullam varius.,10/23/24
43,494,430,4,"Maecenas rhoncus aliquam lacus. Morbi quis tortor id nulla ultrices aliquet. Maecenas leo odio, condimentum id, luctus nec, molestie sed, justo. Pellentesque viverra pede ac diam.",4/9/25
44,765,142,2,Duis bibendum. Morbi non quam nec dui luctus rutrum. Nulla tellus.,6/17/25
45,117,791,2,"Morbi vestibulum, velit id pretium iaculis, diam erat fermentum justo, nec condimentum neque sapien placerat ante. Nulla justo. Aliquam quis turpis eget elit sodales scelerisque.",2/12/25
46,661,13,5,"Nam dui. Proin leo odio, porttitor id, consequat in, consequat ut, nulla. Sed accumsan felis.",5/18/25
47,844,511,5,"Vestibulum ante ipsum primis in faucibus orci luctus et ultrices posuere cubilia Curae; Donec pharetra, magna vestibulum aliquet ultrices, erat tortor sollicitudin mi, sit amet lobortis sapien sapien non mi. Integer ac neque. Duis bibendum. Morbi non quam nec dui luctus rutrum.",7/10/24
48,171,79,3,"Mauris ullamcorper purus sit amet nulla. Quisque arcu libero, rutrum ac, lobortis vel, dapibus at, diam.",5/5/25
49,359,494,5,"Donec odio justo, sollicitudin ut, suscipit a, feugiat et, eros.",8/15/25
50,705,389,4,Integer ac neque.,6/12/24
51,771,779,3,"Mauris enim leo, rhoncus sed, vestibulum sit amet, cursus id, turpis. Integer aliquet, massa id lobortis convallis, tortor risus dapibus augue, vel accumsan tellus nisi eu orci.",4/2/25
52,88,362,3,"Integer non velit. Donec diam neque, vestibulum eget, vulputate ut, ultrices vel, augue.",7/20/25
53,883,408,4,Aliquam quis turpis eget elit sodales scelerisque. Mauris sit amet eros. Suspendisse accumsan tortor quis turpis. Sed ante.,5/28/25
54,4,699,5,Phasellus in felis. Donec semper sapien a libero. Nam dui.,2/4/25
55,361,400,4,In hac habitasse platea dictumst. Maecenas ut massa quis augue luctus tincidunt. Nulla mollis molestie lorem.,3/4/25
56,28,408,4,"Mauris ullamcorper purus sit amet nulla. Quisque arcu libero, rutrum ac, lobortis vel, dapibus at, diam.",12/28/24
57,637,695,1,In hac habitasse platea dictumst.,6/7/24
58,450,423,1,"Quisque erat eros, viverra eget, congue eget, semper rutrum, nulla.",4/18/25
59,852,6,3,Morbi non lectus.,6/8/24
60,543,439,4,"Fusce lacus purus, aliquet at, feugiat non, pretium quis, lectus. Suspendisse potenti. In eleifend quam a odio. In hac habitasse platea dictumst.",5/26/24
61,182,551,4,Mauris sit amet eros. Suspendisse accumsan tortor quis turpis. Sed ante.,1/11/25
62,674,79,4,"Cras in purus eu magna vulputate luctus. Cum sociis natoque penatibus et magnis dis parturient montes, nascetur ridiculus mus.",7/10/24
63,825,659,1,Duis aliquam convallis nunc. Proin at turpis a pede posuere nonummy. Integer non velit.,1/17/25
64,376,544,3,Quisque ut erat. Curabitur gravida nisi at nibh.,4/1/25
65,551,824,3,"Nulla nisl. Nunc nisl. Duis bibendum, felis sed interdum venenatis, turpis enim blandit mi, in porttitor pede justo eu massa.",3/9/25
66,532,481,4,Proin eu mi.,4/6/25
67,593,993,3,"Cras mi pede, malesuada in, imperdiet et, commodo vulputate, justo. In blandit ultrices enim.",5/24/24
68,25,96,5,Maecenas tincidunt lacus at velit. Vivamus vel nulla eget eros elementum pellentesque. Quisque porta volutpat erat.,8/14/24
69,812,573,2,Suspendisse ornare consequat lectus.,5/19/25
70,95,973,2,"Suspendisse ornare consequat lectus. In est risus, auctor sed, tristique in, tempus sit amet, sem. Fusce consequat. Nulla nisl.",5/11/25
71,470,128,2,"Donec vitae nisi. Nam ultrices, libero non mattis pulvinar, nulla pede ullamcorper augue, a suscipit nulla elit ac nulla. Sed vel enim sit amet nunc viverra dapibus.",3/15/25
72,579,767,5,"Curabitur in libero ut massa volutpat convallis. Morbi odio odio, elementum eu, interdum eu, tincidunt in, leo.",11/19/24
73,996,59,4,Praesent id massa id nisl venenatis lacinia.,7/8/24
74,57,730,1,"Sed sagittis. Nam congue, risus semper porta volutpat, quam pede lobortis ligula, sit amet eleifend pede libero quis orci.",6/30/24
75,202,781,1,"Proin at turpis a pede posuere nonummy. Integer non velit. Donec diam neque, vestibulum eget, vulputate ut, ultrices vel, augue.",4/27/25
76,983,742,4,Cras non velit nec nisi vulputate nonummy. Maecenas tincidunt lacus at velit. Vivamus vel nulla eget eros elementum pellentesque. Quisque porta volutpat erat.,8/13/24
77,472,810,5,"Fusce congue, diam id ornare imperdiet, sapien urna pretium nisl, ut volutpat sapien arcu sed augue. Aliquam erat volutpat. In congue.",12/20/24
78,870,635,2,"Morbi vestibulum, velit id pretium iaculis, diam erat fermentum justo, nec condimentum neque sapien placerat ante.",6/9/25
79,573,125,5,Nulla mollis molestie lorem. Quisque ut erat. Curabitur gravida nisi at nibh. In hac habitasse platea dictumst.,6/8/25
80,523,969,5,Praesent blandit lacinia erat.,5/26/24
81,60,725,5,"Vestibulum ante ipsum primis in faucibus orci luctus et ultrices posuere cubilia Curae; Donec pharetra, magna vestibulum aliquet ultrices, erat tortor sollicitudin mi, sit amet lobortis sapien sapien non mi.",8/1/24
82,764,887,2,"Nam ultrices, libero non mattis pulvinar, nulla pede ullamcorper augue, a suscipit nulla elit ac nulla. Sed vel enim sit amet nunc viverra dapibus. Nulla suscipit ligula in lacus. Curabitur at ipsum ac tellus semper interdum.",11/12/24
83,350,399,1,Nullam varius.,7/4/24
84,568,685,4,Pellentesque at nulla. Suspendisse potenti.,10/16/24
85,605,762,1,Pellentesque at nulla. Suspendisse potenti. Cras in purus eu magna vulputate luctus.,4/9/25
86,631,565,1,"Vestibulum quam sapien, varius ut, blandit non, interdum in, ante.",4/2/25
87,955,298,5,"Nam nulla. Integer pede justo, lacinia eget, tincidunt eget, tempus vel, pede. Morbi porttitor lorem id ligula. Suspendisse ornare consequat lectus.",8/19/24
88,862,705,3,Donec vitae nisi.,8/6/25
89,339,402,3,Nulla ut erat id mauris vulputate elementum.,6/11/24
90,252,462,1,Ut tellus. Nulla ut erat id mauris vulputate elementum. Nullam varius.,4/10/25
91,391,778,1,Duis bibendum. Morbi non quam nec dui luctus rutrum.,8/11/24
92,46,713,5,Duis aliquam convallis nunc.,1/5/25
93,847,193,4,Phasellus id sapien in sapien iaculis congue.,8/10/24
94,21,237,4,In eleifend quam a odio. In hac habitasse platea dictumst.,7/5/25
95,398,482,1,Pellentesque eget nunc.,6/29/24
96,706,345,4,Duis bibendum.,2/14/25
97,156,5,2,Etiam vel augue. Vestibulum rutrum rutrum neque. Aenean auctor gravida sem. Praesent id massa id nisl venenatis lacinia.,9/6/24
98,300,220,5,Vestibulum ante ipsum primis in faucibus orci luctus et ultrices posuere cubilia Curae; Duis faucibus accumsan odio. Curabitur convallis. Duis consequat dui nec nisi volutpat eleifend. Donec ut dolor.,7/29/25
99,437,409,1,"Fusce posuere felis sed lacus. Morbi sem mauris, laoreet ut, rhoncus aliquet, pulvinar sed, nisl. Nunc rhoncus dui vel sem. Sed sagittis.",3/21/25
100,17,575,2,Fusce consequat. Nulla nisl. Nunc nisl.,9/16/24
101,330,424,2,Duis mattis egestas metus.,10/24/24
102,500,172,4,In eleifend quam a odio.,12/22/24
103,928,820,5,Proin risus. Praesent lectus.,10/18/24
104,925,97,1,Nulla ut erat id mauris vulputate elementum. Nullam varius.,4/10/25
105,264,930,2,Donec posuere metus vitae ipsum. Aliquam non mauris.,6/10/25
106,83,935,4,"Donec ut dolor. Morbi vel lectus in quam fringilla rhoncus. Mauris enim leo, rhoncus sed, vestibulum sit amet, cursus id, turpis. Integer aliquet, massa id lobortis convallis, tortor risus dapibus augue, vel accumsan tellus nisi eu orci.",8/6/24
107,729,513,3,Phasellus in felis.,4/24/25
108,238,251,4,"Mauris enim leo, rhoncus sed, vestibulum sit amet, cursus id, turpis. Integer aliquet, massa id lobortis convallis, tortor risus dapibus augue, vel accumsan tellus nisi eu orci. Mauris lacinia sapien quis libero. Nullam sit amet turpis elementum ligula vehicula consequat.",6/18/25
109,745,89,4,Suspendisse accumsan tortor quis turpis. Sed ante. Vivamus tortor. Duis mattis egestas metus.,1/11/25
110,673,574,4,"Fusce posuere felis sed lacus. Morbi sem mauris, laoreet ut, rhoncus aliquet, pulvinar sed, nisl.",9/10/24
111,140,645,3,"In tempor, turpis nec euismod scelerisque, quam turpis adipiscing lorem, vitae mattis nibh ligula nec sem.",1/23/25
112,393,250,2,In hac habitasse platea dictumst.,12/24/24
113,517,51,1,Vivamus in felis eu sapien cursus vestibulum.,5/30/24
114,993,157,4,"Cras pellentesque volutpat dui. Maecenas tristique, est et tempus semper, est quam pharetra magna, ac consequat metus sapien ut nunc. Vestibulum ante ipsum primis in faucibus orci luctus et ultrices posuere cubilia Curae; Mauris viverra diam vitae quam.",6/9/24
115,888,601,4,Nullam sit amet turpis elementum ligula vehicula consequat. Morbi a ipsum.,7/5/24
116,333,962,5,"Morbi vestibulum, velit id pretium iaculis, diam erat fermentum justo, nec condimentum neque sapien placerat ante. Nulla justo.",2/18/25
117,22,681,2,"Duis at velit eu est congue elementum. In hac habitasse platea dictumst. Morbi vestibulum, velit id pretium iaculis, diam erat fermentum justo, nec condimentum neque sapien placerat ante.",6/28/24
118,601,450,1,"Fusce lacus purus, aliquet at, feugiat non, pretium quis, lectus. Suspendisse potenti. In eleifend quam a odio.",11/18/24
119,954,599,2,Vivamus tortor.,6/22/25
120,303,94,2,"Maecenas tristique, est et tempus semper, est quam pharetra magna, ac consequat metus sapien ut nunc. Vestibulum ante ipsum primis in faucibus orci luctus et ultrices posuere cubilia Curae; Mauris viverra diam vitae quam. Suspendisse potenti. Nullam porttitor lacus at turpis.",7/16/25
121,485,830,3,"Vivamus metus arcu, adipiscing molestie, hendrerit at, vulputate vitae, nisl. Aenean lectus.",8/11/25
122,944,669,3,Nulla nisl.,5/30/24
123,350,456,5,"In est risus, auctor sed, tristique in, tempus sit amet, sem.",2/5/25
124,555,8,3,"Morbi non lectus. Aliquam sit amet diam in magna bibendum imperdiet. Nullam orci pede, venenatis non, sodales sed, tincidunt eu, felis. Fusce posuere felis sed lacus.",5/11/25
125,983,746,5,"Aliquam augue quam, sollicitudin vitae, consectetuer eget, rutrum at, lorem. Integer tincidunt ante vel ipsum. Praesent blandit lacinia erat.",4/3/25
126,50,48,4,"Quisque arcu libero, rutrum ac, lobortis vel, dapibus at, diam. Nam tristique tortor eu pede.",5/28/24
127,819,268,2,Nam tristique tortor eu pede.,11/14/24
128,444,829,5,Proin interdum mauris non ligula pellentesque ultrices. Phasellus id sapien in sapien iaculis congue.,7/19/24
129,194,946,2,"Morbi non lectus. Aliquam sit amet diam in magna bibendum imperdiet. Nullam orci pede, venenatis non, sodales sed, tincidunt eu, felis.",4/28/25
130,117,846,4,Duis consequat dui nec nisi volutpat eleifend.,12/24/24
131,598,832,1,"Cum sociis natoque penatibus et magnis dis parturient montes, nascetur ridiculus mus. Vivamus vestibulum sagittis sapien. Cum sociis natoque penatibus et magnis dis parturient montes, nascetur ridiculus mus.",5/16/25
132,323,991,2,Aenean fermentum. Donec ut mauris eget massa tempor convallis.,6/28/25
133,675,653,1,Mauris sit amet eros. Suspendisse accumsan tortor quis turpis.,7/7/24
134,151,548,4,"Proin at turpis a pede posuere nonummy. Integer non velit. Donec diam neque, vestibulum eget, vulputate ut, ultrices vel, augue.",7/14/25
135,757,277,2,"Cum sociis natoque penatibus et magnis dis parturient montes, nascetur ridiculus mus.",8/18/24
136,718,74,2,Quisque id justo sit amet sapien dignissim vestibulum. Vestibulum ante ipsum primis in faucibus orci luctus et ultrices posuere cubilia Curae; Nulla dapibus dolor vel est.,8/15/24
137,543,635,4,Maecenas tincidunt lacus at velit.,4/13/25
138,530,564,2,"In tempor, turpis nec euismod scelerisque, quam turpis adipiscing lorem, vitae mattis nibh ligula nec sem. Duis aliquam convallis nunc. Proin at turpis a pede posuere nonummy.",1/17/25
139,166,51,5,Phasellus sit amet erat. Nulla tempus.,12/23/24
140,382,258,3,Morbi ut odio.,5/24/25
141,206,330,3,Nullam sit amet turpis elementum ligula vehicula consequat. Morbi a ipsum.,7/17/24
142,850,4,1,Nunc purus.,9/10/24
143,242,729,2,Nulla ut erat id mauris vulputate elementum. Nullam varius.,6/22/25
144,137,757,5,"Duis at velit eu est congue elementum. In hac habitasse platea dictumst. Morbi vestibulum, velit id pretium iaculis, diam erat fermentum justo, nec condimentum neque sapien placerat ante. Nulla justo.",3/2/25
145,141,245,5,Vestibulum sed magna at nunc commodo placerat. Praesent blandit.,1/13/25
146,343,498,3,"Proin eu mi. Nulla ac enim. In tempor, turpis nec euismod scelerisque, quam turpis adipiscing lorem, vitae mattis nibh ligula nec sem. Duis aliquam convallis nunc.",1/21/25
147,683,760,1,Nullam varius. Nulla facilisi. Cras non velit nec nisi vulputate nonummy. Maecenas tincidunt lacus at velit.,6/27/25
148,621,190,5,"Donec diam neque, vestibulum eget, vulputate ut, ultrices vel, augue. Vestibulum ante ipsum primis in faucibus orci luctus et ultrices posuere cubilia Curae; Donec pharetra, magna vestibulum aliquet ultrices, erat tortor sollicitudin mi, sit amet lobortis sapien sapien non mi. Integer ac neque.",6/12/25
149,786,138,3,Praesent id massa id nisl venenatis lacinia. Aenean sit amet justo.,8/6/25
150,666,758,4,Sed ante.,2/23/25
151,552,788,5,"Integer aliquet, massa id lobortis convallis, tortor risus dapibus augue, vel accumsan tellus nisi eu orci.",10/1/24
152,509,83,1,"Nulla neque libero, convallis eget, eleifend luctus, ultricies eu, nibh.",8/16/24
153,469,918,1,"Quisque erat eros, viverra eget, congue eget, semper rutrum, nulla. Nunc purus. Phasellus in felis.",2/10/25
154,291,847,3,"Praesent lectus. Vestibulum quam sapien, varius ut, blandit non, interdum in, ante. Vestibulum ante ipsum primis in faucibus orci luctus et ultrices posuere cubilia Curae; Duis faucibus accumsan odio.",6/3/24
155,481,234,2,"Proin leo odio, porttitor id, consequat in, consequat ut, nulla.",8/15/25
156,110,822,3,Mauris lacinia sapien quis libero. Nullam sit amet turpis elementum ligula vehicula consequat.,2/25/25
157,118,15,3,Suspendisse accumsan tortor quis turpis. Sed ante. Vivamus tortor. Duis mattis egestas metus.,5/3/25
158,673,427,2,"Morbi vestibulum, velit id pretium iaculis, diam erat fermentum justo, nec condimentum neque sapien placerat ante. Nulla justo. Aliquam quis turpis eget elit sodales scelerisque. Mauris sit amet eros.",7/10/24
159,586,612,2,"Cum sociis natoque penatibus et magnis dis parturient montes, nascetur ridiculus mus.",7/14/24
160,717,761,1,Pellentesque viverra pede ac diam.,6/30/24
161,850,727,3,Nunc purus. Phasellus in felis. Donec semper sapien a libero. Nam dui.,2/16/25
162,772,911,5,"Suspendisse potenti. Cras in purus eu magna vulputate luctus. Cum sociis natoque penatibus et magnis dis parturient montes, nascetur ridiculus mus.",6/17/24
163,659,198,4,"Aliquam augue quam, sollicitudin vitae, consectetuer eget, rutrum at, lorem. Integer tincidunt ante vel ipsum.",7/11/24
164,887,101,5,Maecenas ut massa quis augue luctus tincidunt. Nulla mollis molestie lorem. Quisque ut erat.,2/13/25
165,407,952,5,"Quisque arcu libero, rutrum ac, lobortis vel, dapibus at, diam.",2/23/25
166,948,435,4,"Integer non velit. Donec diam neque, vestibulum eget, vulputate ut, ultrices vel, augue. Vestibulum ante ipsum primis in faucibus orci luctus et ultrices posuere cubilia Curae; Donec pharetra, magna vestibulum aliquet ultrices, erat tortor sollicitudin mi, sit amet lobortis sapien sapien non mi. Integer ac neque.",12/6/24
167,886,32,1,"Nulla neque libero, convallis eget, eleifend luctus, ultricies eu, nibh.",7/16/24
168,101,285,2,In hac habitasse platea dictumst.,6/20/24
169,537,48,5,"Pellentesque at nulla. Suspendisse potenti. Cras in purus eu magna vulputate luctus. Cum sociis natoque penatibus et magnis dis parturient montes, nascetur ridiculus mus.",1/18/25
170,758,736,5,Aliquam quis turpis eget elit sodales scelerisque. Mauris sit amet eros.,7/28/24
171,720,258,3,"Nunc nisl. Duis bibendum, felis sed interdum venenatis, turpis enim blandit mi, in porttitor pede justo eu massa. Donec dapibus.",1/3/25
172,336,963,4,Maecenas ut massa quis augue luctus tincidunt. Nulla mollis molestie lorem. Quisque ut erat. Curabitur gravida nisi at nibh.,5/29/25
173,582,26,3,"Integer non velit. Donec diam neque, vestibulum eget, vulputate ut, ultrices vel, augue. Vestibulum ante ipsum primis in faucibus orci luctus et ultrices posuere cubilia Curae; Donec pharetra, magna vestibulum aliquet ultrices, erat tortor sollicitudin mi, sit amet lobortis sapien sapien non mi.",2/5/25
174,631,215,4,Donec posuere metus vitae ipsum.,6/21/25
175,170,176,3,Nulla tellus. In sagittis dui vel nisl. Duis ac nibh.,6/25/25
176,608,965,3,In congue. Etiam justo. Etiam pretium iaculis justo. In hac habitasse platea dictumst.,5/31/24
177,546,273,1,"Quisque ut erat. Curabitur gravida nisi at nibh. In hac habitasse platea dictumst. Aliquam augue quam, sollicitudin vitae, consectetuer eget, rutrum at, lorem.",3/2/25
178,984,619,2,Etiam pretium iaculis justo. In hac habitasse platea dictumst. Etiam faucibus cursus urna.,10/20/24
179,223,550,4,Integer ac neque. Duis bibendum. Morbi non quam nec dui luctus rutrum. Nulla tellus.,2/3/25
180,268,395,2,Sed vel enim sit amet nunc viverra dapibus. Nulla suscipit ligula in lacus.,9/3/24
181,67,405,4,"In hac habitasse platea dictumst. Aliquam augue quam, sollicitudin vitae, consectetuer eget, rutrum at, lorem. Integer tincidunt ante vel ipsum. Praesent blandit lacinia erat.",2/5/25
182,236,191,5,Etiam faucibus cursus urna. Ut tellus.,10/23/24
183,522,712,1,Integer a nibh. In quis justo.,11/18/24
184,14,176,2,"Vestibulum ac est lacinia nisi venenatis tristique. Fusce congue, diam id ornare imperdiet, sapien urna pretium nisl, ut volutpat sapien arcu sed augue.",6/29/25
185,241,68,2,"Nunc nisl. Duis bibendum, felis sed interdum venenatis, turpis enim blandit mi, in porttitor pede justo eu massa. Donec dapibus. Duis at velit eu est congue elementum.",5/12/25
186,476,344,4,"Nam congue, risus semper porta volutpat, quam pede lobortis ligula, sit amet eleifend pede libero quis orci.",10/11/24
187,223,331,5,"Fusce posuere felis sed lacus. Morbi sem mauris, laoreet ut, rhoncus aliquet, pulvinar sed, nisl.",3/5/25
188,90,726,1,"Vestibulum ante ipsum primis in faucibus orci luctus et ultrices posuere cubilia Curae; Donec pharetra, magna vestibulum aliquet ultrices, erat tortor sollicitudin mi, sit amet lobortis sapien sapien non mi. Integer ac neque. Duis bibendum.",3/25/25
189,192,966,2,Nulla mollis molestie lorem. Quisque ut erat. Curabitur gravida nisi at nibh.,5/12/25
190,179,883,1,Nulla mollis molestie lorem. Quisque ut erat.,2/4/25
191,946,495,5,Maecenas ut massa quis augue luctus tincidunt. Nulla mollis molestie lorem. Quisque ut erat.,10/2/24
192,144,906,5,"Proin eu mi. Nulla ac enim. In tempor, turpis nec euismod scelerisque, quam turpis adipiscing lorem, vitae mattis nibh ligula nec sem. Duis aliquam convallis nunc.",5/22/25
193,899,942,4,In eleifend quam a odio. In hac habitasse platea dictumst.,6/23/24
194,434,577,3,Vestibulum rutrum rutrum neque. Aenean auctor gravida sem. Praesent id massa id nisl venenatis lacinia. Aenean sit amet justo.,5/22/24
195,279,494,2,"Morbi quis tortor id nulla ultrices aliquet. Maecenas leo odio, condimentum id, luctus nec, molestie sed, justo.",6/18/24
196,636,368,1,"In quis justo. Maecenas rhoncus aliquam lacus. Morbi quis tortor id nulla ultrices aliquet. Maecenas leo odio, condimentum id, luctus nec, molestie sed, justo.",7/28/25
197,586,544,5,"Integer aliquet, massa id lobortis convallis, tortor risus dapibus augue, vel accumsan tellus nisi eu orci. Mauris lacinia sapien quis libero.",3/14/25
198,618,158,1,Aenean sit amet justo. Morbi ut odio.,9/1/24
199,97,746,4,Quisque id justo sit amet sapien dignissim vestibulum. Vestibulum ante ipsum primis in faucibus orci luctus et ultrices posuere cubilia Curae; Nulla dapibus dolor vel est.,7/28/24
200,275,896,4,"Morbi ut odio. Cras mi pede, malesuada in, imperdiet et, commodo vulputate, justo. In blandit ultrices enim.",11/21/24
201,710,929,1,Ut tellus.,5/19/25
202,965,777,4,"Lorem ipsum dolor sit amet, consectetuer adipiscing elit.",7/26/24
