review_id,user_id,movie_id,rating,comment,created_at
380,6,353,1,"Morbi ut odio. Cras mi pede, malesuada in, imperdiet et, commodo vulputate, justo. In blandit ultrices enim. Lorem ipsum dolor sit amet, consectetuer adipiscing elit.",1/26/25
381,839,493,4,"Sed sagittis. Nam congue, risus semper porta volutpat, quam pede lobortis ligula, sit amet eleifend pede libero quis orci. Nullam molestie nibh in lectus. Pellentesque at nulla.",10/27/24
382,435,990,1,"Maecenas tincidunt lacus at velit. Vivamus vel nulla eget eros elementum pellentesque. Quisque porta volutpat erat. Quisque erat eros, viverra eget, congue eget, semper rutrum, nulla.",5/22/24
383,329,579,2,"Duis bibendum, felis sed interdum venenatis, turpis enim blandit mi, in porttitor pede justo eu massa.",3/8/25
384,74,881,5,Nunc purus. Phasellus in felis. Donec semper sapien a libero.,6/27/25
385,594,808,4,"Quisque erat eros, viverra eget, congue eget, semper rutrum, nulla. Nunc purus. Phasellus in felis. Donec semper sapien a libero.",3/9/25
386,284,464,3,"Morbi vestibulum, velit id pretium iaculis, diam erat fermentum justo, nec condimentum neque sapien placerat ante. Nulla justo. Aliquam quis turpis eget elit sodales scelerisque. Mauris sit amet eros.",7/16/24
387,450,493,2,Duis consequat dui nec nisi volutpat eleifend.,6/19/24
388,802,887,5,"Phasellus id sapien in sapien iaculis congue. Vivamus metus arcu, adipiscing molestie, hendrerit at, vulputate vitae, nisl. Aenean lectus. Pellentesque eget nunc.",10/19/24
389,136,663,1,Morbi a ipsum. Integer a nibh. In quis justo. Maecenas rhoncus aliquam lacus.,5/25/25
390,426,963,4,Etiam faucibus cursus urna. Ut tellus. Nulla ut erat id mauris vulputate elementum. Nullam varius.,7/1/25
391,279,859,2,"Nullam orci pede, venenatis non, sodales sed, tincidunt eu, felis. Fusce posuere felis sed lacus. Morbi sem mauris, laoreet ut, rhoncus aliquet, pulvinar sed, nisl. Nunc rhoncus dui vel sem.",12/7/24
392,519,131,1,Nullam porttitor lacus at turpis. Donec posuere metus vitae ipsum.,10/17/24
393,132,896,4,"Proin at turpis a pede posuere nonummy. Integer non velit. Donec diam neque, vestibulum eget, vulputate ut, ultrices vel, augue.",4/22/25
394,880,186,5,"Aliquam non mauris. Morbi non lectus. Aliquam sit amet diam in magna bibendum imperdiet. Nullam orci pede, venenatis non, sodales sed, tincidunt eu, felis.",7/8/24
395,683,798,4,Sed vel enim sit amet nunc viverra dapibus. Nulla suscipit ligula in lacus. Curabitur at ipsum ac tellus semper interdum. Mauris ullamcorper purus sit amet nulla.,2/17/25
396,416,932,1,"Mauris ullamcorper purus sit amet nulla. Quisque arcu libero, rutrum ac, lobortis vel, dapibus at, diam.",8/12/24
397,901,491,1,"Donec diam neque, vestibulum eget, vulputate ut, ultrices vel, augue. Vestibulum ante ipsum primis in faucibus orci luctus et ultrices posuere cubilia Curae; Donec pharetra, magna vestibulum aliquet ultrices, erat tortor sollicitudin mi, sit amet lobortis sapien sapien non mi. Integer ac neque.",7/16/24
398,772,219,1,"Vestibulum ante ipsum primis in faucibus orci luctus et ultrices posuere cubilia Curae; Nulla dapibus dolor vel est. Donec odio justo, sollicitudin ut, suscipit a, feugiat et, eros. Vestibulum ac est lacinia nisi venenatis tristique. Fusce congue, diam id ornare imperdiet, sapien urna pretium nisl, ut volutpat sapien arcu sed augue.",8/24/24
399,714,716,4,Aenean lectus. Pellentesque eget nunc.,6/18/25
400,145,527,3,"Donec ut mauris eget massa tempor convallis. Nulla neque libero, convallis eget, eleifend luctus, ultricies eu, nibh. Quisque id justo sit amet sapien dignissim vestibulum.",6/6/25
401,225,821,2,Etiam justo. Etiam pretium iaculis justo.,2/6/25
402,375,368,4,"Cum sociis natoque penatibus et magnis dis parturient montes, nascetur ridiculus mus.",7/24/24
403,696,74,1,"Nullam orci pede, venenatis non, sodales sed, tincidunt eu, felis.",3/12/25
404,285,271,1,"Maecenas tristique, est et tempus semper, est quam pharetra magna, ac consequat metus sapien ut nunc. Vestibulum ante ipsum primis in faucibus orci luctus et ultrices posuere cubilia Curae; Mauris viverra diam vitae quam. Suspendisse potenti. Nullam porttitor lacus at turpis.",2/19/25
405,639,621,2,"Integer pede justo, lacinia eget, tincidunt eget, tempus vel, pede. Morbi porttitor lorem id ligula.",6/24/25
406,130,208,4,"Cum sociis natoque penatibus et magnis dis parturient montes, nascetur ridiculus mus. Etiam vel augue.",6/12/24
407,103,34,2,"Nulla ac enim. In tempor, turpis nec euismod scelerisque, quam turpis adipiscing lorem, vitae mattis nibh ligula nec sem. Duis aliquam convallis nunc. Proin at turpis a pede posuere nonummy.",5/22/25
408,540,577,4,Morbi vel lectus in quam fringilla rhoncus.,4/6/25
409,164,27,2,"Vestibulum ante ipsum primis in faucibus orci luctus et ultrices posuere cubilia Curae; Nulla dapibus dolor vel est. Donec odio justo, sollicitudin ut, suscipit a, feugiat et, eros. Vestibulum ac est lacinia nisi venenatis tristique. Fusce congue, diam id ornare imperdiet, sapien urna pretium nisl, ut volutpat sapien arcu sed augue.",4/27/25
410,769,967,2,Aenean fermentum.,3/22/25
411,392,839,3,"In tempor, turpis nec euismod scelerisque, quam turpis adipiscing lorem, vitae mattis nibh ligula nec sem. Duis aliquam convallis nunc. Proin at turpis a pede posuere nonummy. Integer non velit.",8/22/24
412,304,89,5,"Fusce posuere felis sed lacus. Morbi sem mauris, laoreet ut, rhoncus aliquet, pulvinar sed, nisl.",7/1/25
413,916,712,2,"Cras mi pede, malesuada in, imperdiet et, commodo vulputate, justo. In blandit ultrices enim.",8/14/24
414,338,939,5,Etiam justo. Etiam pretium iaculis justo.,2/15/25
415,578,453,5,Suspendisse potenti.,8/1/25
416,321,726,2,"Aliquam augue quam, sollicitudin vitae, consectetuer eget, rutrum at, lorem. Integer tincidunt ante vel ipsum. Praesent blandit lacinia erat.",4/18/25
417,390,601,5,"Fusce congue, diam id ornare imperdiet, sapien urna pretium nisl, ut volutpat sapien arcu sed augue. Aliquam erat volutpat. In congue. Etiam justo.",2/5/25
418,158,102,3,Curabitur convallis.,2/15/25
419,891,186,1,In hac habitasse platea dictumst. Maecenas ut massa quis augue luctus tincidunt. Nulla mollis molestie lorem. Quisque ut erat.,2/14/25
420,544,408,2,"Duis bibendum, felis sed interdum venenatis, turpis enim blandit mi, in porttitor pede justo eu massa. Donec dapibus.",10/10/24
421,94,812,5,"Nullam orci pede, venenatis non, sodales sed, tincidunt eu, felis. Fusce posuere felis sed lacus. Morbi sem mauris, laoreet ut, rhoncus aliquet, pulvinar sed, nisl. Nunc rhoncus dui vel sem.",12/31/24
422,588,30,5,"Duis ac nibh. Fusce lacus purus, aliquet at, feugiat non, pretium quis, lectus. Suspendisse potenti. In eleifend quam a odio.",3/13/25
423,164,239,2,Vivamus in felis eu sapien cursus vestibulum.,5/25/25
424,391,722,4,"Nam congue, risus semper porta volutpat, quam pede lobortis ligula, sit amet eleifend pede libero quis orci. Nullam molestie nibh in lectus.",3/5/25
425,632,380,5,Donec posuere metus vitae ipsum. Aliquam non mauris. Morbi non lectus.,7/16/25
426,652,376,2,Morbi a ipsum.,5/6/25
427,156,913,2,"Suspendisse ornare consequat lectus. In est risus, auctor sed, tristique in, tempus sit amet, sem. Fusce consequat.",5/30/24
428,116,547,3,"Maecenas rhoncus aliquam lacus. Morbi quis tortor id nulla ultrices aliquet. Maecenas leo odio, condimentum id, luctus nec, molestie sed, justo. Pellentesque viverra pede ac diam.",9/29/24
429,343,120,3,"Aenean fermentum. Donec ut mauris eget massa tempor convallis. Nulla neque libero, convallis eget, eleifend luctus, ultricies eu, nibh. Quisque id justo sit amet sapien dignissim vestibulum.",7/2/25
430,964,197,3,Maecenas rhoncus aliquam lacus. Morbi quis tortor id nulla ultrices aliquet.,8/5/25
431,867,322,2,Phasellus id sapien in sapien iaculis congue.,1/9/25
432,944,43,2,"Pellentesque ultrices mattis odio. Donec vitae nisi. Nam ultrices, libero non mattis pulvinar, nulla pede ullamcorper augue, a suscipit nulla elit ac nulla. Sed vel enim sit amet nunc viverra dapibus.",2/24/25
433,363,154,4,Nulla ut erat id mauris vulputate elementum. Nullam varius.,7/8/24
434,336,198,3,"Praesent blandit. Nam nulla. Integer pede justo, lacinia eget, tincidunt eget, tempus vel, pede. Morbi porttitor lorem id ligula.",3/11/25
435,447,773,2,"Morbi sem mauris, laoreet ut, rhoncus aliquet, pulvinar sed, nisl. Nunc rhoncus dui vel sem. Sed sagittis. Nam congue, risus semper porta volutpat, quam pede lobortis ligula, sit amet eleifend pede libero quis orci.",12/7/24
436,659,578,3,Donec ut mauris eget massa tempor convallis.,8/27/24
437,617,568,4,"In quis justo. Maecenas rhoncus aliquam lacus. Morbi quis tortor id nulla ultrices aliquet. Maecenas leo odio, condimentum id, luctus nec, molestie sed, justo.",6/14/24
438,867,662,3,Integer ac leo. Pellentesque ultrices mattis odio. Donec vitae nisi.,12/31/24
439,266,533,2,"In est risus, auctor sed, tristique in, tempus sit amet, sem. Fusce consequat. Nulla nisl.",7/27/24
440,899,722,5,"Nam dui. Proin leo odio, porttitor id, consequat in, consequat ut, nulla.",8/13/24
441,721,593,4,In hac habitasse platea dictumst.,6/10/25
442,475,382,2,"Nam nulla. Integer pede justo, lacinia eget, tincidunt eget, tempus vel, pede.",6/13/25
443,524,68,5,"Nam dui. Proin leo odio, porttitor id, consequat in, consequat ut, nulla. Sed accumsan felis.",12/6/24
444,309,551,5,"Curabitur at ipsum ac tellus semper interdum. Mauris ullamcorper purus sit amet nulla. Quisque arcu libero, rutrum ac, lobortis vel, dapibus at, diam. Nam tristique tortor eu pede.",8/6/25
445,299,464,2,"Vivamus in felis eu sapien cursus vestibulum. Proin eu mi. Nulla ac enim. In tempor, turpis nec euismod scelerisque, quam turpis adipiscing lorem, vitae mattis nibh ligula nec sem.",11/15/24
446,640,863,1,Quisque ut erat. Curabitur gravida nisi at nibh. In hac habitasse platea dictumst.,5/16/24
447,371,95,2,"Duis ac nibh. Fusce lacus purus, aliquet at, feugiat non, pretium quis, lectus. Suspendisse potenti. In eleifend quam a odio.",10/11/24
448,764,936,5,Etiam faucibus cursus urna.,5/23/24
449,7,707,2,Phasellus sit amet erat. Nulla tempus.,7/29/24
450,53,289,4,"Donec ut mauris eget massa tempor convallis. Nulla neque libero, convallis eget, eleifend luctus, ultricies eu, nibh.",10/12/24
451,735,494,4,"Quisque arcu libero, rutrum ac, lobortis vel, dapibus at, diam. Nam tristique tortor eu pede.",8/15/24
452,103,356,2,Donec dapibus. Duis at velit eu est congue elementum. In hac habitasse platea dictumst.,8/31/24
453,427,239,5,"Quisque erat eros, viverra eget, congue eget, semper rutrum, nulla.",8/26/24
454,628,767,4,"Proin leo odio, porttitor id, consequat in, consequat ut, nulla. Sed accumsan felis. Ut at dolor quis odio consequat varius. Integer ac leo.",7/2/25
455,96,967,5,"Aenean sit amet justo. Morbi ut odio. Cras mi pede, malesuada in, imperdiet et, commodo vulputate, justo.",5/19/25
456,446,545,5,"In est risus, auctor sed, tristique in, tempus sit amet, sem. Fusce consequat.",8/20/24
457,858,46,3,Etiam justo. Etiam pretium iaculis justo. In hac habitasse platea dictumst.,8/12/25
458,215,464,1,Maecenas pulvinar lobortis est.,1/17/25
459,693,347,1,Vivamus vel nulla eget eros elementum pellentesque.,2/26/25
460,319,198,4,"Aenean sit amet justo. Morbi ut odio. Cras mi pede, malesuada in, imperdiet et, commodo vulputate, justo. In blandit ultrices enim.",10/13/24
461,324,100,4,Integer tincidunt ante vel ipsum. Praesent blandit lacinia erat.,10/5/24
462,533,674,4,Mauris lacinia sapien quis libero. Nullam sit amet turpis elementum ligula vehicula consequat. Morbi a ipsum.,12/24/24
463,113,19,3,Nulla facilisi. Cras non velit nec nisi vulputate nonummy. Maecenas tincidunt lacus at velit.,7/25/24
464,998,178,1,"In blandit ultrices enim. Lorem ipsum dolor sit amet, consectetuer adipiscing elit. Proin interdum mauris non ligula pellentesque ultrices. Phasellus id sapien in sapien iaculis congue.",8/25/24
465,936,556,3,Nullam molestie nibh in lectus. Pellentesque at nulla.,2/27/25
466,390,12,4,Donec posuere metus vitae ipsum. Aliquam non mauris. Morbi non lectus. Aliquam sit amet diam in magna bibendum imperdiet.,10/2/24
467,463,661,4,"Fusce lacus purus, aliquet at, feugiat non, pretium quis, lectus.",8/10/25
468,179,294,2,"Donec diam neque, vestibulum eget, vulputate ut, ultrices vel, augue. Vestibulum ante ipsum primis in faucibus orci luctus et ultrices posuere cubilia Curae; Donec pharetra, magna vestibulum aliquet ultrices, erat tortor sollicitudin mi, sit amet lobortis sapien sapien non mi. Integer ac neque.",4/14/25
469,946,191,2,"Suspendisse ornare consequat lectus. In est risus, auctor sed, tristique in, tempus sit amet, sem. Fusce consequat. Nulla nisl.",1/28/25
470,989,186,1,Pellentesque at nulla. Suspendisse potenti. Cras in purus eu magna vulputate luctus.,10/7/24
471,260,11,1,Vestibulum ante ipsum primis in faucibus orci luctus et ultrices posuere cubilia Curae; Mauris viverra diam vitae quam.,11/1/24
472,30,845,1,Nulla suscipit ligula in lacus. Curabitur at ipsum ac tellus semper interdum.,3/20/25
473,612,409,4,In congue. Etiam justo. Etiam pretium iaculis justo.,2/22/25
474,621,928,1,Vestibulum sed magna at nunc commodo placerat. Praesent blandit.,8/18/24
475,538,869,2,"Suspendisse potenti. Cras in purus eu magna vulputate luctus. Cum sociis natoque penatibus et magnis dis parturient montes, nascetur ridiculus mus.",6/23/25
476,656,575,2,Ut at dolor quis odio consequat varius.,10/11/24
477,870,979,2,Donec semper sapien a libero. Nam dui.,3/9/25
478,590,446,2,"Fusce lacus purus, aliquet at, feugiat non, pretium quis, lectus.",7/19/25
479,391,919,5,"In sagittis dui vel nisl. Duis ac nibh. Fusce lacus purus, aliquet at, feugiat non, pretium quis, lectus. Suspendisse potenti.",4/25/25
480,534,917,5,"Lorem ipsum dolor sit amet, consectetuer adipiscing elit. Proin interdum mauris non ligula pellentesque ultrices. Phasellus id sapien in sapien iaculis congue. Vivamus metus arcu, adipiscing molestie, hendrerit at, vulputate vitae, nisl.",12/20/24
481,469,862,1,In hac habitasse platea dictumst. Maecenas ut massa quis augue luctus tincidunt. Nulla mollis molestie lorem.,7/14/24
482,257,297,3,"Proin interdum mauris non ligula pellentesque ultrices. Phasellus id sapien in sapien iaculis congue. Vivamus metus arcu, adipiscing molestie, hendrerit at, vulputate vitae, nisl. Aenean lectus.",7/1/25
483,669,315,2,Morbi a ipsum. Integer a nibh. In quis justo. Maecenas rhoncus aliquam lacus.,9/23/24
484,33,433,3,"In est risus, auctor sed, tristique in, tempus sit amet, sem. Fusce consequat.",2/5/25
485,606,51,3,"Quisque porta volutpat erat. Quisque erat eros, viverra eget, congue eget, semper rutrum, nulla.",9/19/24
486,27,29,1,"Phasellus id sapien in sapien iaculis congue. Vivamus metus arcu, adipiscing molestie, hendrerit at, vulputate vitae, nisl.",7/15/24
487,49,176,4,"Cum sociis natoque penatibus et magnis dis parturient montes, nascetur ridiculus mus. Etiam vel augue.",7/9/24
488,195,788,3,Etiam pretium iaculis justo.,7/26/25
489,880,210,1,In hac habitasse platea dictumst. Etiam faucibus cursus urna. Ut tellus.,8/14/24
490,848,684,4,"Integer pede justo, lacinia eget, tincidunt eget, tempus vel, pede. Morbi porttitor lorem id ligula.",8/13/25
491,79,27,2,Nunc nisl.,6/30/25
492,385,783,5,Cras non velit nec nisi vulputate nonummy.,7/27/25
493,855,519,5,Nunc purus. Phasellus in felis.,10/29/24
494,688,647,1,"Nullam orci pede, venenatis non, sodales sed, tincidunt eu, felis.",7/21/25
495,354,447,1,"Vestibulum quam sapien, varius ut, blandit non, interdum in, ante.",12/8/24
496,159,128,5,Aenean fermentum. Donec ut mauris eget massa tempor convallis.,1/5/25
497,755,610,4,Aenean sit amet justo.,7/28/24
498,872,382,4,"Mauris enim leo, rhoncus sed, vestibulum sit amet, cursus id, turpis. Integer aliquet, massa id lobortis convallis, tortor risus dapibus augue, vel accumsan tellus nisi eu orci.",8/9/24
499,906,54,3,"Nunc rhoncus dui vel sem. Sed sagittis. Nam congue, risus semper porta volutpat, quam pede lobortis ligula, sit amet eleifend pede libero quis orci. Nullam molestie nibh in lectus.",7/28/25
500,607,266,4,"Nam ultrices, libero non mattis pulvinar, nulla pede ullamcorper augue, a suscipit nulla elit ac nulla. Sed vel enim sit amet nunc viverra dapibus. Nulla suscipit ligula in lacus. Curabitur at ipsum ac tellus semper interdum.",7/14/24
501,9,600,3,"Morbi vel lectus in quam fringilla rhoncus. Mauris enim leo, rhoncus sed, vestibulum sit amet, cursus id, turpis.",3/11/25
502,242,530,4,Aliquam erat volutpat.,7/23/25
503,850,573,4,Pellentesque eget nunc. Donec quis orci eget orci vehicula condimentum. Curabitur in libero ut massa volutpat convallis.,6/6/25
504,389,67,5,Cras in purus eu magna vulputate luctus.,10/21/24
505,709,340,4,"In hac habitasse platea dictumst. Morbi vestibulum, velit id pretium iaculis, diam erat fermentum justo, nec condimentum neque sapien placerat ante.",6/14/24
506,707,82,3,Morbi vel lectus in quam fringilla rhoncus.,10/27/24
507,670,445,5,"Nam dui. Proin leo odio, porttitor id, consequat in, consequat ut, nulla. Sed accumsan felis. Ut at dolor quis odio consequat varius.",12/20/24
508,337,327,3,"Proin interdum mauris non ligula pellentesque ultrices. Phasellus id sapien in sapien iaculis congue. Vivamus metus arcu, adipiscing molestie, hendrerit at, vulputate vitae, nisl. Aenean lectus.",2/25/25
509,636,388,4,"Maecenas leo odio, condimentum id, luctus nec, molestie sed, justo.",10/17/24
510,981,461,4,"Nam dui. Proin leo odio, porttitor id, consequat in, consequat ut, nulla.",6/28/25
511,215,650,2,Vestibulum ante ipsum primis in faucibus orci luctus et ultrices posuere cubilia Curae; Duis faucibus accumsan odio.,10/10/24
512,829,932,4,Nunc purus. Phasellus in felis. Donec semper sapien a libero.,4/7/25
513,767,791,3,Aenean auctor gravida sem. Praesent id massa id nisl venenatis lacinia. Aenean sit amet justo.,6/8/24
514,453,714,5,Phasellus sit amet erat. Nulla tempus.,7/9/24
515,575,315,3,"Quisque porta volutpat erat. Quisque erat eros, viverra eget, congue eget, semper rutrum, nulla.",5/22/25
516,122,939,2,Nullam sit amet turpis elementum ligula vehicula consequat. Morbi a ipsum. Integer a nibh.,10/11/24
517,246,396,2,Integer a nibh. In quis justo. Maecenas rhoncus aliquam lacus. Morbi quis tortor id nulla ultrices aliquet.,10/30/24
518,992,656,4,Aenean sit amet justo. Morbi ut odio.,8/24/24
519,541,602,3,"In est risus, auctor sed, tristique in, tempus sit amet, sem. Fusce consequat.",7/25/24
520,282,507,1,Curabitur convallis. Duis consequat dui nec nisi volutpat eleifend. Donec ut dolor. Morbi vel lectus in quam fringilla rhoncus.,8/5/25
521,905,767,4,"Duis ac nibh. Fusce lacus purus, aliquet at, feugiat non, pretium quis, lectus. Suspendisse potenti.",1/7/25
522,510,394,3,Curabitur convallis. Duis consequat dui nec nisi volutpat eleifend. Donec ut dolor.,5/28/24
523,944,623,1,"Proin risus. Praesent lectus. Vestibulum quam sapien, varius ut, blandit non, interdum in, ante. Vestibulum ante ipsum primis in faucibus orci luctus et ultrices posuere cubilia Curae; Duis faucibus accumsan odio.",1/15/25
524,765,924,5,Donec posuere metus vitae ipsum.,10/28/24
525,772,206,2,In hac habitasse platea dictumst.,5/24/25
526,106,402,1,Mauris sit amet eros. Suspendisse accumsan tortor quis turpis.,12/30/24
527,482,716,1,"Sed sagittis. Nam congue, risus semper porta volutpat, quam pede lobortis ligula, sit amet eleifend pede libero quis orci. Nullam molestie nibh in lectus. Pellentesque at nulla.",9/16/24
528,795,361,5,Integer tincidunt ante vel ipsum.,5/28/25
529,246,323,3,"Proin eu mi. Nulla ac enim. In tempor, turpis nec euismod scelerisque, quam turpis adipiscing lorem, vitae mattis nibh ligula nec sem. Duis aliquam convallis nunc.",4/18/25
530,198,500,3,"Quisque id justo sit amet sapien dignissim vestibulum. Vestibulum ante ipsum primis in faucibus orci luctus et ultrices posuere cubilia Curae; Nulla dapibus dolor vel est. Donec odio justo, sollicitudin ut, suscipit a, feugiat et, eros. Vestibulum ac est lacinia nisi venenatis tristique.",4/14/25
531,839,822,3,Curabitur at ipsum ac tellus semper interdum.,9/14/24
532,702,51,3,Maecenas pulvinar lobortis est. Phasellus sit amet erat.,10/5/24
533,879,538,2,Aliquam non mauris. Morbi non lectus.,2/17/25
534,531,871,1,Mauris lacinia sapien quis libero. Nullam sit amet turpis elementum ligula vehicula consequat.,7/14/25
535,425,394,2,Suspendisse potenti.,10/16/24
536,845,764,4,In hac habitasse platea dictumst.,5/17/24
537,290,675,2,"Vestibulum ac est lacinia nisi venenatis tristique. Fusce congue, diam id ornare imperdiet, sapien urna pretium nisl, ut volutpat sapien arcu sed augue.",1/20/25
538,450,253,2,Duis bibendum.,11/4/24
539,699,926,1,"Donec diam neque, vestibulum eget, vulputate ut, ultrices vel, augue. Vestibulum ante ipsum primis in faucibus orci luctus et ultrices posuere cubilia Curae; Donec pharetra, magna vestibulum aliquet ultrices, erat tortor sollicitudin mi, sit amet lobortis sapien sapien non mi. Integer ac neque. Duis bibendum.",6/17/25
540,727,205,4,"Proin at turpis a pede posuere nonummy. Integer non velit. Donec diam neque, vestibulum eget, vulputate ut, ultrices vel, augue. Vestibulum ante ipsum primis in faucibus orci luctus et ultrices posuere cubilia Curae; Donec pharetra, magna vestibulum aliquet ultrices, erat tortor sollicitudin mi, sit amet lobortis sapien sapien non mi.",8/20/24
541,284,79,5,"Morbi vel lectus in quam fringilla rhoncus. Mauris enim leo, rhoncus sed, vestibulum sit amet, cursus id, turpis.",3/6/25
542,55,928,1,"Aenean sit amet justo. Morbi ut odio. Cras mi pede, malesuada in, imperdiet et, commodo vulputate, justo. In blandit ultrices enim.",12/29/24
543,641,512,2,"In est risus, auctor sed, tristique in, tempus sit amet, sem.",5/4/25
544,295,757,3,"Aliquam augue quam, sollicitudin vitae, consectetuer eget, rutrum at, lorem. Integer tincidunt ante vel ipsum. Praesent blandit lacinia erat. Vestibulum sed magna at nunc commodo placerat.",4/10/25
545,60,522,1,Curabitur gravida nisi at nibh.,6/12/24
546,89,639,4,Duis at velit eu est congue elementum.,2/10/25
547,822,743,2,Morbi a ipsum. Integer a nibh. In quis justo.,6/17/25
548,8,700,4,"Nullam orci pede, venenatis non, sodales sed, tincidunt eu, felis. Fusce posuere felis sed lacus. Morbi sem mauris, laoreet ut, rhoncus aliquet, pulvinar sed, nisl. Nunc rhoncus dui vel sem.",9/24/24
549,883,582,5,"Fusce lacus purus, aliquet at, feugiat non, pretium quis, lectus. Suspendisse potenti. In eleifend quam a odio. In hac habitasse platea dictumst.",10/2/24
550,999,160,5,Integer a nibh.,1/18/25
551,576,112,5,"Nulla ac enim. In tempor, turpis nec euismod scelerisque, quam turpis adipiscing lorem, vitae mattis nibh ligula nec sem.",6/19/25
552,730,322,4,Quisque id justo sit amet sapien dignissim vestibulum. Vestibulum ante ipsum primis in faucibus orci luctus et ultrices posuere cubilia Curae; Nulla dapibus dolor vel est.,7/18/25
553,397,391,4,Mauris sit amet eros. Suspendisse accumsan tortor quis turpis. Sed ante.,1/13/25
554,547,260,3,"Quisque erat eros, viverra eget, congue eget, semper rutrum, nulla.",1/16/25
555,211,956,3,"Phasellus id sapien in sapien iaculis congue. Vivamus metus arcu, adipiscing molestie, hendrerit at, vulputate vitae, nisl. Aenean lectus.",9/10/24
556,408,36,5,"Mauris enim leo, rhoncus sed, vestibulum sit amet, cursus id, turpis. Integer aliquet, massa id lobortis convallis, tortor risus dapibus augue, vel accumsan tellus nisi eu orci. Mauris lacinia sapien quis libero.",9/29/24
557,352,985,5,"Aenean fermentum. Donec ut mauris eget massa tempor convallis. Nulla neque libero, convallis eget, eleifend luctus, ultricies eu, nibh.",2/7/25
558,474,658,2,In congue. Etiam justo.,3/8/25
559,508,578,2,Nunc rhoncus dui vel sem. Sed sagittis.,6/30/25
560,743,16,1,Donec posuere metus vitae ipsum.,7/25/24
561,94,690,2,Nulla suscipit ligula in lacus.,8/30/24
562,685,537,3,"Proin risus. Praesent lectus. Vestibulum quam sapien, varius ut, blandit non, interdum in, ante.",6/23/24
563,741,275,5,"Pellentesque viverra pede ac diam. Cras pellentesque volutpat dui. Maecenas tristique, est et tempus semper, est quam pharetra magna, ac consequat metus sapien ut nunc.",6/27/24
564,133,121,2,"Vestibulum ac est lacinia nisi venenatis tristique. Fusce congue, diam id ornare imperdiet, sapien urna pretium nisl, ut volutpat sapien arcu sed augue.",8/5/24
565,16,936,2,Cras non velit nec nisi vulputate nonummy. Maecenas tincidunt lacus at velit. Vivamus vel nulla eget eros elementum pellentesque. Quisque porta volutpat erat.,5/8/25
566,723,147,1,"Quisque porta volutpat erat. Quisque erat eros, viverra eget, congue eget, semper rutrum, nulla. Nunc purus.",6/29/25
567,448,896,1,Morbi non lectus. Aliquam sit amet diam in magna bibendum imperdiet.,3/21/25
568,980,534,2,"Maecenas tristique, est et tempus semper, est quam pharetra magna, ac consequat metus sapien ut nunc.",3/15/25
569,632,110,4,Donec dapibus. Duis at velit eu est congue elementum. In hac habitasse platea dictumst.,6/18/25
570,662,737,3,Vivamus in felis eu sapien cursus vestibulum.,3/12/25
571,664,861,2,Nulla tempus.,11/2/24
572,29,308,2,"Curabitur in libero ut massa volutpat convallis. Morbi odio odio, elementum eu, interdum eu, tincidunt in, leo. Maecenas pulvinar lobortis est.",1/22/25
573,533,64,2,Pellentesque ultrices mattis odio.,3/31/25
574,544,752,3,Proin eu mi.,9/14/24
575,965,938,5,Duis bibendum.,9/25/24
576,785,200,5,"Morbi sem mauris, laoreet ut, rhoncus aliquet, pulvinar sed, nisl. Nunc rhoncus dui vel sem.",12/24/24
577,879,571,5,Nulla facilisi. Cras non velit nec nisi vulputate nonummy. Maecenas tincidunt lacus at velit. Vivamus vel nulla eget eros elementum pellentesque.,7/23/24
578,280,294,5,Aenean auctor gravida sem. Praesent id massa id nisl venenatis lacinia. Aenean sit amet justo.,4/24/25
579,55,793,5,"Nunc rhoncus dui vel sem. Sed sagittis. Nam congue, risus semper porta volutpat, quam pede lobortis ligula, sit amet eleifend pede libero quis orci.",11/7/24
580,280,785,2,Aenean fermentum.,4/28/25
581,576,907,5,Nunc nisl.,10/8/24
